School Code,School Name,Address,Pincode,Block Code,District Code
11001,ZILA SCHOOL PURNEA,,,1128,11
11002,URSULINE CONVENT GIRLS HIGH SCHOOL PURNEA,,,1128,11
11003,B B M HIGH SCHOOL PURNEA,,,1128,11
11004,GOVT GIRLS HIGH SCHOOL PURNEA,,,1128,11
11005,"MAA KALI HIGH SCHOOL MADHUBANI, PURNEA",,,1128,11
11006,"JLNS HIGH SCHOOL GULAB BAGH, PURNEA",,,1128,11
11007,"PARWATI MANDAL HIGH SCHOOL HARDA, PURNEA",,,1128,11
11008,"ANCHIT SAH HIGH SCHOOL BELOURI, PURNEA",,,1128,11
11009,"HIGH SCHOOL CHANDI RAZIGANJ, PURNEA",,,1128,11
11010,"GOVT HIGH SCHOOL SHRI NAGAR, PURNEA",,,1128,11
11011,"SIYA MOHAN HIGH SCHOOL SAHARA, PURNEA",,,1128,11
11012,"R P C HIGH SCHOOL PURNEA CITY, PURNEA",,,1128,11
11013,"HIGH SCHOOL KASBA, PURNEA",,,1128,11
11014,"K D GIRLS HIGH SCHOOL KASBA, PURNEA",,,1128,11
11015,"PROJECT GIRLS HIGH SCHOOL RANI PATRA, PURNEA",,,1128,11
11016,"K G P +2 SENIOR SECONDARY HIGH SCHOOL, BHOGA BHATGAMA, PURNEA",,,1128,11
11017,"N D RUNGTA H/S JALAL GARH, PURNEA",,,1128,11
11018,"KALA NAND H/S GARH BANAILI, PURNEA",,,1128,11
11019,"B N H/S JAGNICHAMPA NAGAR, PURNEA",,,1128,11
11020,"PROJECT GIRLS HIGH SCHOOL GOKUL PUR, PURNEA",,,1128,11
11021,ST THOMAS H S MUNSHIBARI PURNEA,,,1128,11
11022,B C KANYA RES H S PURNEA,,,1128,11
11023,"PURNEA H S RAMBAGH,PURNEA",,,1128,11
11024,"HIGH SCHOOL HAFANIA, PURNEA",,,1128,11
11025,"HIGH SCHOOL KANHARIA, PURNEA",,,1128,11
11026,"KANAK LAL H/S SOURA, PURNEA",,,1128,11
11027,"ABUL KALAM HIGH SCHOOL ICHALO, PURNEA",,,1128,11
11028,"PROJECT GIRLS HIGH SCHOOL AMOUR, PURNEA",,,1128,11
11029,"HIGH SCHOOL RAUTA, PURNEA",,,1128,11
11030,"HIGH SCHOOL AMOUR, PURNEA",,,1128,11
11031,"HIGH SCHOOL BAISI, PURNEA",,,1128,11
11032,"HIGH SCHOOL JHOWARI, PURNEA",,,1128,11
11033,"JANTA HIGH SCHOOL BISHNUPUR, PURNEA",,,1128,11
11034,"T N HIGH SCHOOL PIYAZI, PURNEA",,,1128,11
11035,"HIGH SCHOOL KANJIA, PURNEA",,,1128,11
11036,"PROJECT KANYA H S BAISI, PURNEA",,,1128,11
11037,"UGRA NARAYAN H/S VIDYAPURI, PURNEA",,,1128,11
11038,"BALDEVA H/S BHAWANIPUR RAJDHAM, PURNEA",,,1128,11
11039,"PROJECT M L GIRLS H/S BHAWANIPUR RAJDHAM, PURNEA",,,1128,11
11040,"PROJECT GIRLS H/S RUPOULI, PURNEA",,,1128,11
11041,"HIGH SCHOOL RUPOULI, PURNEA",,,1128,11
11042,"MADHAV SARWAJANIK H/S KUARI, PURNEA",,,1128,11
11043,"M M R D HIGH SCHOOL AMARI, PURNEA",,,1128,11
11044,"G S T R H/S MOGALIAPURN DHAMDAHA, PURNEA",,,1128,11
11045,"P P HIGH SCHOOL BHOWA DEORHI, PURNEA",,,1128,11
11046,"DURGA H/S MOGALIA PURANDAHA, PURNEA",,,1128,11
11047,"GYANWATI HIGH SCHOOL MOUZAMPATTI, PURNEA",,,1128,11
11048,"BAIDYA NATH H/S BALIA, PURNEA",,,1128,11
11049,"SHYAMA HIGH SCHOOL BHATOTAR, PURNEA",,,1128,11
11050,"BIRANCHI MANDAL H/S BARHARI, PURNEA",,,1128,11
11051,"S S S S H/S TIKAPATTI, PURNEA",,,1128,11
11052,"PROJECT GIRLS H/S DHAMDAHA, PURNEA",,,1128,11
11053,"B B HIGH SCHOOL SARSI, PURNEA",,,1128,11
11054,"HIGH SCHOOL AKBARPUR, PURNEA",,,1128,11
11055,"HIGH SCHOOL DHAMDAHA, PURNEA",,,1128,11
11056,"S HIGH SCHOOL AURAHI GOVINDPUR, PURNEA",,,1128,11
11057,"SANT VINAY H S SATAMI, PURNEA",,,1128,11
11058,"PROJECT KANYA H S BARHARI, PURNEA",,,1128,11
11059,"MATU RAM GIRLS H/S BANMANKHI, PURNEA",,,1128,11
11060,"SUMRIT HIGH SCHOOL BANMANKHI, PURNEA",,,1128,11
11061,"H S DHODHAIPIPARA, PURNEA",,,1128,11
11062,"THAKUR H S KHUNT, PURNEA",,,1128,11
11063,"GOVT S T H S BANMANKHI, PURNEA",,,1128,11
11064,"GOVT AMBEDKAR H S JANKINAGAR, PURNEA",,,1128,11
11065,"LILJU HIGH SCHOOL BURHIA, PURNEA",,,1128,11
11066,"S A L M C HIGH SCHOOL BANMANKHI, PURNEA",,,1128,11
11301,"UTKRAMIT M S MACHHATTA, PURNEA",,,1128,11
11302,"UTKRAMIT M S MALOPARA BAISI, PURNEA",,,1128,11
11303,"UTKRAMIT M S JANKINAGAR HAAT BANMANKHI, PURNEA",,,1128,11
11304,"ADARSH UTKRAMIT M S PARORA K NAGAR, PURNEA",,,1128,11
11305,"ADARSH UTKRAMIT M S VISHNUPUR DHAMDAHA, PURNEA",,,1128,11
11306,"UTKRAMIT M S KASBA SANJHAULI KASBA, PURNEA",,,1128,11
11307,"UTKRAMIT M S LALGANJ VIJAY LALGANJ RUPAULI, PURNEA",,,1128,11
11308,"UTKRAMIT M S BRAHMGANI SUPAULI BHAWANIPUR, PURNEA",,,1128,11
11309,"UTKRAMIT M S AATA MABAIYA BAISI, PURNEA",,,1128,11
11310,"UTKRAMIT M S MAHAMMADPUR HARKAIHLI DAGARUA, PURNEA",,,1128,11
11311,"UTKRAMIT M S BAIRIYA GAURIYAR RUPAULI, PURNEA",,,1128,11
11313,"UTKRAMIT M S GAUASI K NAGAR, PURNEA",,,1128,11
11314,"UTKRAMIT M S MARANGA WEST PURNEA EAST, PURNEA",,,1128,11
11315,"UPGRADED M S BAGDAR DHURPALLI AMAUR, PURNEA",,,1128,11
11316,"UTKRAMIT M S RAMPUR TILAK, PURNEA",,,1128,11
11317,"UTKRAMIT MADHYAMIK SCHOOL CHAMPAWATI, PURNEA",,,1128,11
11318,"UTKRAMIT MADHYAMIK SCHOOL CHANDPUR BHANGHA, PURNEA",,,1128,11
11319,"UTKRAMIT MADHYAMIK SCHOOL HARIMURHI, PURNEA",,,1128,11
11320,"UTKRAMIT MADHYAMIK SCHOOL LAXMIPUR, PURNEA",,,1128,11
11321,"UTKRAMIT MADHYAMIK SCHOOL PRANPATTI, PURNEA",,,1128,11
11322,"UTKRAMIT MADHYAMIK SCHOOL KAJHA, PURNEA",,,1128,11
11323,"UTKRAMIT MADHYAMIK SCHOOL SAURAHA, PURNEA",,,1128,11
11324,"UTKRAMIT MADHYAMIK SCHOOL GARHI BALUWA, PURNEA",,,1128,11
11325,"UTKRAMIT MADHYAMIK SCHOOL BISHANPUR, PURNEA",,,1128,11
11326,"UTKRAMIT MADHYAMIK SCHOOL ROUTI BASHA, PURNEA",,,1128,11
11327,"UTKRAMIT MADHYAMIK SCHOOL TALBARI, PURNEA",,,1128,11
11328,"UTKRAMIT MADHYAMIK SCHOOL SIRSI, PURNEA",,,1128,11
11329,"UTKRAMIT MADHYAMIK SCHOOL AMIRGANJ, PURNEA",,,1128,11
11330,"UTKRAMIT MADHYAMIK SCHOOL KODHELI, PURNEA",,,1128,11
11331,"UTKRAMIT MADHYAMIK SCHOOL BABHNI, PURNEA",,,1128,11
11332,"UTKRAMIT MADHYAMIK SCHOOL BELGCHHI, PURNEA",,,1128,11
11333,"UTKRAMIT MADHYAMIK SCHOOL GORIAR, PURNEA",,,1128,11
11334,"UTKRAMIT MADHYAMIK SCHOOL DUMRI, PURNEA",,,1128,11
11335,"UTKRAMIT MADHYAMIK SCH SANJHA GHAAT,DHAMDAHA, PURNEA",,,1128,11
11336,"UTKRAMIT MADHYAMIK SCHOOL MEERGANJ, DHAMDAHA, PURNEA",,,1128,11
11337,"UTKRAMIT MADHYAMIK SCH G.RAM DAMGARA,DHAMDAHA, PURNEA",,,1128,11
11338,"UTKRAMIT MADHYAMIK SCHOOL LAKHANARE, AMOUR, PURNEA",,,1128,11
11339,"UTKRAMIT MADHYAMIK SCHOOL BELKA, AMOUR, PURNEA",,,1128,11
11340,"UTKRAMIT MADHYAMIK SCH B TOLA ISLAMPUR,AMOUR, PURNEA",,,1128,11
11341,"UTKRAMIT MADHYAMIK SCHOOL MAJGAMA, KASBA, PURNEA",,,1128,11
11342,"UTKRAMIT MADHYAMIK SCHOOL LACHHANPUR, KASBA, PURNEA",,,1128,11
11343,"UTKRAMIT MADHYAMIK SCHOOL MOHANI, KASBA, PURNEA",,,1128,11
11344,"UTKRAMIT MADHYAMIK SCHOOL SONAPUR, BAISI, PURNEA",,,1128,11
11345,"UTKRAMIT MADHYAMIK SCHOOL HARERAMPUR, BAISI, PURNEA",,,1128,11
11346,"UTKRAMIT MADHYAMIK SCHOOL CHARAIYA, BAISI, PURNEA",,,1128,11
11347,"UTKRAMIT MADHYAMIK SCHOOL SHISHAWARI, BAISI, PURNEA",,,1128,11
11348,"UTKRAMIT MADHYAMIK SCHOOL CHANDWAR, BAISI, PURNEA",,,1128,11
11349,"UTKRAMIT MADHYAMIK SCHOOL NANDANIYA, BAISI, PURNEA",,,1128,11
11350,"UTKRAMIT MADHYAMIK SCHOOL DAGARUWA, DAGARUA, PURNEA",,,1128,11
11351,"UTKRAMIT MADHYAMIK SCH C PARA BALUWA,DAGARUA, PURNEA",,,1128,11
11352,"UTKRAMIT MADHYAMIK SCHOOL SIYARAKHAM, DAGARUA, PURNEA",,,1128,11
11353,"UTKRAMIT MADHYAMIK SCH MATIYARPUR,JALALGARDH, PURNEA",,,1128,11
11354,"UTKRAMIT MADHYAMIK SCH KATHAILI, JALALGARDH, PURNEA",,,1128,11
11355,"UTKRAMIT MADHYAMIK SCHOOL EKAMBA, JALALGARDH, PURNEA",,,1128,11
11356,"UTKRAMIT M S PRAKHAND COLONY,K.NAGAR, PURNEA",,,1128,11
11357,"UTKRAMIT M S PRASADPUR BELDARI, K NAGAR, PURNEA",,,1128,11
11358,"UTKRAMIT M S KAJHA GANESHPUR,K NAGAR, PURNEA",,,1128,11
11359,"UTKRAMIT MADHYAMIK SCHOOL PIPARA, PURNEA EAST, PURNEA",,,1128,11
11360,"UTKRAMIT MADHYAMIK SCH MAHARAJPUR,PURNEA EAST, PURNEA",,,1128,11
11361,"UTKRAMIT MADHYAMIK SCHOOL JAGAILI, SRINAGAR, PURNEA",,,1128,11
11362,"UTKRAMIT M S GANGA BHAWAN KHOKHA, SRINAGAR, PURNEA",,,1128,11
11363,"UTKRAMIT MADHYAMIK SCHOOL SUDHUBELI,KASBA, PURNEA",,,1128,11
11364,"UTKRAMIT MADHYAMIK SCH JIYANGANJ GURAHI,KASBA, PURNEA",,,1128,11
11365,"UTKRAMIT M S KAMALPUR BHAMRA LAAGAN, KASBA, PURNEA",,,1128,11
11366,"UTKRAMIT M S SORSONI BIJULIYA, JALALGARDH, PURNEA",,,1128,11
11367,"UTKRAMIT MADHYAMIK SCHOOL MADHWA, BAISI, PURNEA",,,1128,11
11368,"UTKRAMIT MADHYAMIK SCHOOL MAHALWARI, DAGRUA, PURNEA",,,1128,11
11369,"UTKRAMIT MADHYAMIK SCHOOL BELWA, PURNEA EAST, PURNEA",,,1128,11
11370,"UTKRAMIT MADHYAMIK SCHOOL SONDEEP, BHAWNIPUR, PURNEA",,,1128,11
11371,"UTKRAMIT MADHYAMIK SCH GAHIL STHAN, B KOTHI, PURNEA",,,1128,11
11372,"NAUWAT LAL UTKRAMIT M S KUKRAOUN -2, DHAMDAHA, PURNEA",,,1128,11
11373,"UTKRAMIT M S CHIKANI PATRAHA, B KOTHI, PURNEA",,,1128,11
11374,"UTKRAMIT MADHYAMIK SCHOOL GANGAILI, BANMANKHI, PURNEA",,,1128,11
11375,"UTKRAMIT M S JIYANGANJ MIDDLE, BANMANKHI, PURNEA",,,1128,11
11376,"UTKRAMIT MADHYAMIK SCHOOL KAJHI, BANMANKHI, PURNEA",,,1128,11
11377,"UTKRAMIT M S GULABTOLE MALLDIHA, B KOTHI, PURNEA",,,1128,11
11378,"UTKRAMIT MADHYAMIK SCHOOL RANGPURA, DHAMDAHA, PURNEA",,,1128,11
11379,"UTKRAMIT MADHYAMIK SCHOOL BHATSARA, B KOTHI, PURNEA",,,1128,11
11380,"UTKRAMIT MADHYAMIK SCH HARIPURMADI, BANMANKHI, PURNEA",,,1128,11
11381,"UTKRAMIT MADHYAMIK SCHOOL SUKHSENA, B KOTHI, PURNEA",,,1128,11
11382,"ABHYAS UTKRAMIT MADHYAMIK SCH NIRPUR,DHAMDAHA, PURNEA",,,1128,11
11383,"UTKRAMIT MADHYAMIK SCHOOL NIPNIA, B KOTHI, PURNEA",,,1128,11
11384,"UTKRAMIT MADHYAMIK SCHOOL SAHSAUL, B KOTHI, PURNEA",,,1128,11
11385,"UTKRAMIT MADHYAMIK SCHOOL DEVOTTAR, BANMANKHI, PURNEA",,,1128,11
11386,"UTKRAMIT M S HASAILI KHUTTI, SRI NAGAR, PURNEA",,,1128,11
11387,"UTKRAMIT MADHYAMIK SCHOOL BORARHI, BANMANKHI, PURNEA",,,1128,11
11389,"UTKRAMIT MADHYAMIK SCH LALGANJ, PURNEA EAST, PURNEA",,,1128,11
11390,UTKRAMIT M SCH SINDHIA DIWANGANJ PURNEA,,,1128,11
11391,"UTKRAMIT MADHYAMIK SCHOOL AMCHURA, PURNEA",,,1128,11
11392,"UTKRAMIT HIGH SCHOOL, MAHWALA, RUPAULI, PURNEA",,,1128,11
11393,"UTKRAMIT HIGH SCHOOL, BHAWA KANP, RUPAULI, PURNEA",,,1128,11
11394,"UTKRAMIT HIGH SCHOOL, CHHARRAPATTI, RUPAULI, PURNEA",,,1128,11
11395,"UTKRAMIT HIGH SCHOOL, TINTANGA, RUPAULI, PURNEA",,,1128,11
11396,"UTKRAMIT HIGH SCHOOL, BALUTOL, B.KOTHI, PURNEA",,,1128,11
11397,"UTKRAMIT HIGH SCHOOL, HANUMAN NAGAR -K, B.KOTHI, PURNEA",,,1128,11
11398,UTKRAMIT HIGH SCHOOL MIRCHAIBARI PURNEA,,,1128,11
11399,"UTKRAMIT HIGH SCHOOL, RADHANAGAR, BANMANKHI, PURNEA",,,1128,11
11400,"UTKRAMIT HIGH SCHOOL, RAGHUNATHPUR, BANMANKHI, PURNEA",,,1128,11
11401,"UTKRAMIT HIGH SCHOOL, BEGAMPUR KHATA, K.NAGAR, PURNEA",,,1128,11
11402,"UTKRAMIT HIGH SCHOOL, DUMRA, BHAWANIPUR, PURNEA",,,1128,11
11403,"UTKRAMIT HIGH SCHOOL, SONDIHA LATHI, BHAWANIPUR, PURNEA",,,1128,11
11404,"UTKRAMIT HIGH SCHOOL, DURGAPUR, BHAWANIPUR, PURNEA",,,1128,11
11405,"UTKRAMIT HIGH SCHOOL, MADARPUR, PURNEA EAST, PURNEA",,,1128,11
11406,"UTKRAMIT HIGH SCHOOL, MAJHUA, PURNEA EAST, PURNEA",,,1128,11
11407,"UTKRAMIT HIGH SCHOOL, LASANPUR, DAGRUA, PURNEA",,,1128,11
11408,"UTKRAMIT HIGH SCHOOL, LALOGARH, BANMANKHI, PURNEA",,,1128,11
11409,"UTKRAMIT HIGH SCHOOL, GANGAILI, AMOUR, PURNEA",,,1128,11
11410,"UTKRAMIT HIGH SCHOOL, PARASMANI, DHAMDAHA, PURNEA",,,1128,11
11411,"UTKRAMIT HIGH SCHOOL, BAKHRIKOL, K. NAGAR, PURNEA",,,1128,11
11412,"UTKRAMIT HIGH SCHOOL, CHAPAY GANGELI, K. NAGAR, PURENA, PURNEA",,,1128,11
11413,"UTKRAMIT HIGH SCHOOL, RAHUA WEST, K. NAGAR, PURNEA",,,1128,11
11414,"UTKRAMIT HIGH SCHOOL, BARAHKONA, DHAMDAHA, PURNEA",,,1128,11
11415,"UTKRAMIT HIGH SCHOOL, ALINAGAR I.K. NAGAR, PURNEA",,,1128,11
11416,"UTKRAMIT HIGH SCHOOL, DHARHAR YAMUNIYAN, DHAMDAHA, PURNEA",,,1128,11
11417,"UTKRAMIT HIGH SCHOOL, SIMRA, RUPAULI, PURNEA",,,1128,11
11418,"UTKRAMIT HIGH SCHOOL, SHRIPUR, BHAWANIPUR, PURNEA",,,1128,11
11419,"UTKRAMIT HIGH SCHOOL, SHAIKHPURA, BHAWANIPUR, PURNEA",,,1128,11
11420,"UTKRAMIT HIGH SCHOOL, BARDELA, DHAMDAHA, PURNEA",,,1128,11
11421,"UTKRAMIT HIGH SCHOOL, KUKRAUN MAKTAB, DHAMDAHA, PURNEA",,,1128,11
11422,"UTKRAMIT HIGH SCHOOL, BARIYA, BYASI, PURNEA",,,1128,11
11423,"UTKRAMIT HIGH SCHOOL, CHANDRAHI, DHAMDAHA, PURNEA",,,1128,11
11424,"UTKRAMIT H.S BAGHWA KANYA, DHAMDAHA, PURNEA",,,1128,11
11425,"UTKARMIT UCHCH  VIDYALAYA (SCHEDULED CASTE), DAMAILI, PURNEA",,,1128,11
11426,"UTKARMIT UCHCH  VIDYALAYA, DHAUKARDHARA, PURNEA",,,1128,11
11427,"UTKARMIT MADHYAMIK UCHCH  VIDYALAYA, MALHARIYA",,,1128,11
11428,"U M S, SHINDHIYA, DAGARUA, PURNEA",,,1128,11
11429,"UTKRAMIT UCHCH VIDYALAYA, BELA CHAND SUKHIYA, BANMANKHI, PURNEA",,,1128,11
11430,"UPGRADED SECONDARY SCHOOL, SINGHIA, SRINAGAR, PURNEA",,,1128,11
11431,"GEETA SHIVRAJ U H/S, MALI, DHAMDAHA, PURANEA",,,1128,11
11432,"UTKRAMIT UCHCH VIDYALAYA, GADHIYA VISHNUPUR, SRI NAGAR, PURANEA",,,1128,11
11433,"U M V, JEEWACHHPUR, BANMANKHI, PURNEA",,,1128,11
11434,"U M V, RAHRIYA KHUTTI, SRINAGAR, PURNEA",,,1128,11
11435,"U H/S SAUTHA, JALALGADH, PURNEA",,,1128,11
11436,"UTKRAMIT UCHCH MADHYAMIK VIDYALAYA, GADDI GHAT KANYA, RUPAULI, PURNEA",,,1128,11
11437,"U M V, CHAK, JALALGARH, PURNEA",,,1128,11
11438,"U M V, SAHURIYA, PURNEA",,,1128,11
11439,"U M V, PARTIYA, PURNEA",,,1128,11
11501,HIGH SCHOOL SARWAILY AMOUR PURNEA,,,1128,11
11502,"SHIV SAHAYA SAGARMAL GIRL'S H S BIROULI, PURNEA",,,1128,11
11503,JOKHAN HIGH SCHOOL BELTARI PURNEA,,,1128,11
11504,KAMAKHYA HIGH SCHOOL KAMAKHYASTHAN PURNEA,,,1128,11
11505,HIGH SCHOOL BAHDURA PURNEA,,,1128,11
11506,KHALIKUL NISHA SAJJAD MILLAR H/S PURNEA,,,1128,11
11507,KANYA UCHCHA VIDYALAYA BHATTA PURNEA,,,1128,11
11508,HIGH SCHOOL DIBRA BAZAR PURNEA,,,1128,11
11509,MUNGA LAL HIGH SCHOOL ORLAHA PURNEA,,,1128,11
11510,D C HIGH SCHOOL BARDELA PURNEA,,,1128,11
11511,HIGH SCHOOL BARAIDGAH PURNEA,,,1128,11
11512,HIGH SCHOOL CHAKMAKA PURNEA,,,1128,11
11701,ST.PETER'S HIGH SCHOOL PURNEA,,,1128,11
11703,"BHOLANATH RAJ VIDYANAND H S B NAGAR SHAHKOL, PURNEA",,,1128,11
11704,MOHAN LAL BAJAJ GIRLS H S GULABBAGH PURNEA,,,1128,11
12001,"L S HIGH SCHOOL PALASI PATEGNA, ARARIA",,,1112,12
12002,"S HIGH SCHOOL BELSARA, ARARIA",,,1112,12
12003,"HIGH SCHOOL KALIAGANJ, ARARIA",,,1112,12
12004,"PROJECT HIGH SCHOOL SIKTY, ARARIA",,,1112,12
12005,"L B S S HIGH SCHOOL PALASI, ARARIA",,,1112,12
12006,"PROJECT GIRLS HIGH SCHOOL KALIAGANJ, ARARIA",,,1112,12
12007,"R A HIGH SCHOOL HANSA KAMALPUR, ARARIA",,,1112,12
12008,"M M PROJECT GIRLS H/S PAHUNSI, ARARIA",,,1112,12
12009,"V N HIGH SCHOOL BHOJPUR, ARARIA",,,1112,12
12010,"PROJECT GIRLS HIGH SCHOOL BARDAHA, ARARIA",,,1112,12
12011,"ZAKIR ACADEMY DEHTI, ARARIA",,,1112,12
12012,S S GIRLS HIGH SCHOOL ARARIA,,,1112,12
12013,"H S URLAHA, ARARIA",,,1112,12
12014,"B L D HIGH SCHOOL RANIGANJ, ARARIA",,,1112,12
12015,AZAD ACADEMY ARARIA,,,1112,12
12016,"HIGH SCHOOL KUARI, ARARIA",,,1112,12
12017,"M G S HIGH SCHOOL ARARIA R S, ARARIA",,,1112,12
12018,"P N HIGH SCHOOL SOHANDARHAT, ARARIA",,,1112,12
12019,"UMA NATH ROY HIGH SCHOOL UDAHAT, ARARIA",,,1112,12
12020,"HIGH SCHOOL MALHARAIA, ARARIA",,,1112,12
12021,"HIGH SCHOOL BARDAHA, ARARIA",,,1112,12
12022,"LALJEE HIGH SCHOOL RANIGANJ, ARARIA",,,1112,12
12023,"HIGH SCHOOL JOKIHAT, ARARIA",,,1112,12
12024,"MOTI HIGH SCHOOL MADANPUR, ARARIA",,,1112,12
12025,"KALAWATI GIRLS HIGH SCHOOL RANIGANJ, ARARIA",,,1112,12
12026,"HIGH SCHOOL KURSAKANTA, ARARIA",,,1112,12
12027,HIGH SCHOOL ARARIA,,,1112,12
12028,"HIGH SCHOOL SIMRAHA, ARARIA",,,1112,12
12029,"LEE ACADEMY FOR BES GANJ, ARARIA",,,1112,12
12030,"HIGH SCHOOL NARPATGANJ, ARARIA",,,1112,12
12031,"HIGH SCHOOL JOGBANI, ARARIA",,,1112,12
12032,"B D G G HIGH SCHOOL FOR BES GANJ, ARARIA",,,1112,12
12033,"S D D N G GOVT H/S FOR BES GANJ, ARARIA",,,1112,12
12034,"RAM NANDAN HIGH SCHOOL RAMAI, ARARIA",,,1112,12
12035,"D D S HIGH SCHOOL FOR BES GANJ, ARARIA",,,1112,12
12036,"K D H/S FULKAHA NAWABGANJ, ARARIA",,,1112,12
12037,"J HIGH SCHOOL PITHAURA, ARARIA",,,1112,12
12038,"JAWAHAR HIGH SCHOOL BHARGAMA, ARARIA",,,1112,12
12039,"RAMLAL HIGH SCHOOL HARIPUR DAK, ARARIA",,,1112,12
12040,"S D R HIGH SCHOOL MAHATHAWA, ARARIA",,,1112,12
12041,"D B H S BEER NAGAR BISHARIA, ARARIA",,,1112,12
12042,"GOVT AMBEDKAR HIGH SCHOOL RAMPUR, ARARIA",,,1112,12
12043,"PROJECT GIRLS H/S NAR PATGANJ, ARARIA",,,1112,12
12044,"HIGH SCHOOL SIMARBANI, ARARIA",,,1112,12
12045,"PROJECT KANYA H S JOKIHAT, ARARIA",,,1112,12
12046,"+2 PROJECT GIRLS HIGH SCHOOL, BHARGAMA,ARARIA",,,1112,12
12301,UTKRAMIT M S PAIKTOLA ARARIA,,,1112,12
12302,UTKRAMIT M S BANSBARI ARARIA,,,1112,12
12303,"UTKRAMIT M S MADHUBANI KHERKHA FORBESGANJ, ARARIA",,,1112,12
12304,"UTKRAMIT M S TERHI MUSAHARI FORBESGANJ, ARARIA",,,1112,12
12305,"UTKRAMIT M S BHOONA JOKIHAT MAJAGAMA, ARARIA",,,1112,12
12306,"UTKRAMIT M S RUPAIL MADHAL PALASI, ARARIA",,,1112,12
12307,"UTKRAMIT M S RAHARIA MANULHA PATTI BHARGAMA, ARARIA",,,1112,12
12308,"UTKRAMIT M S NONIYA TOLA CHAKALA NARPATGANJ, ARARIA",,,1112,12
12309,"BALIKA UTKRAMIT M S GUNWANTI SHRANIGANJ, ARARIA",,,1112,12
12310,"UTKRAMIT M S PARMANANDPUR SHRANIGANJ, ARARIA",,,1112,12
12311,"UTKRAMIT M S KAPAR FORA KURSAKANTA, ARARIA",,,1112,12
12312,"UTKRAMIT M S SOHAGMARO SIKATI, ARARIA",,,1112,12
12313,"ADARSH UTKRAMIT M S MIRJAPUR FORBISGANJ, ARARIA",,,1112,12
12314,"UTKRAMIT M S ACHRA NARPATGANJ, ARARIA",,,1112,12
12315,UTKRAMIT M S ARARIA BASTI ARARIA,,,1112,12
12316,"UTKRAMIT M S HINGNA AURAHI FORBISGANJ, ARARIA",,,1112,12
12317,"UTKRAMIT M S JAHANPUR KESHRRA JOKIHAT, ARARIA",,,1112,12
12318,"UTKRAMIT MS KHABDAH DUMRIYA REWAHI NARPATGANJ, ARARIA",,,1112,12
12319,"UTKRAMIT M S KOSKAPUR KOSKAPUR NORTH RANIGANJ, ARARIA",,,1112,12
12320,"UTKRAMIT M S MANGALWAR CHARIYA BHARGAMA, ARARIA",,,1112,12
12321,"UPGRADE HIGH SCHOOL MALDWAR PURAB, ARARIA",,,1112,12
12322,"UTKRAMIT M S BASMATIYA,, ARARIA",,,1112,12
12323,"UTKRAMIT M S TAMGANJ,, ARARIA",,,1112,12
12324,"UTKRAMIT M S KHAIRA,, ARARIA",,,1112,12
12325,"UTKRAMIT M S MAHESHPATTI,, ARARIA",,,1112,12
12326,"UTKRAMIT M S BARMASIYA,, ARARIA",,,1112,12
12327,"A UTKRAMIT M S KALA BALUA,, ARARIA",,,1112,12
12328,"UTKRAMIT M S SONAMANI GODAM,, ARARIA",,,1112,12
12329,"UTKRAMIT M S SUBHANKARPUR,, ARARIA",,,1112,12
12330,"UTKRAMIT M S GOKHALAPUR BMS, NARPATGANJ, ARARIA",,,1112,12
12331,"UTKRAMIT M S BELA REFUJI, NARPATGANJ, ARARIA",,,1112,12
12332,"UTKRAMIT MADHYAMIK SCHOOL CHANDA, NARPATGANJ, ARARIA",,,1112,12
12333,"UTKRAMIT M S HARIDYEPUR, RANIGANJ, ARARIA",,,1112,12
12334,"UTKRAMIT M S NARAYANPUR, RANIGANJ, ARARIA",,,1112,12
12335,"UTKRAMIT M S DUMARIYA BALAK, RANIGANJ, ARARIA",,,1112,12
12336,"UTKRAMIT M S AMAUNA, FARBESGANJ, ARARIA",,,1112,12
12337,"UTKRAMIT M S PURNDAHA, FARBESGANJ, ARARIA",,,1112,12
12338,"UTKRAMIT M S GORAGACCH, SIKATI, ARARIA",,,1112,12
12339,"UTKRAMIT M S DIMIHIYA, SIKATI, ARARIA",,,1112,12
12340,"UTKRAMIT M S PECHAULI, PALASI, ARARIA",,,1112,12
12341,"UTKRAMIT MADHYAMIK SCHOOL BHAWANI NAGAR, RANIGANJ, ARARIA",,,1112,12
12342,"UTKRAMIT MADHYAMIK SCHOOL BARA ISTAMBARAR, JOKIHAT, ARARIA",,,1112,12
12343,"UTKRAMIT M S LALPUR MAHUA, RANIGANJ, ARARIA",,,1112,12
12344,"UTKRAMIT M S BARHARA, RANIGANJ, ARARIA",,,1112,12
12345,"GIRLS UTKRAMIT M S POTIHIA, RANIGANJ, ARARIA",,,1112,12
12346,"UTKRAMIT M S PARWAHA HARIJAN, FARBESGANJ, ARARIA",,,1112,12
12347,"UTKRAMIT M S SIRSIA KALA, BHARGAMA, ARARIA",,,1112,12
12348,"UTKRAMIT M S MAUJAHA, RANIGANJ, ARARIA",,,1112,12
12349,"UTKRAMIT M S BASGARA RAMPUR, FARBESGANJ, ARARIA",,,1112,12
12350,"UTKRAMIT M S MADHULATA, RANIGANJ, ARARIA",,,1112,12
12351,"UTKRAMIT M S BARA, FARBESGANJ, ARARIA",,,1112,12
12352,"UTKRAMIT M S DARMGANJ, PALASI, ARARIA",,,1112,12
12353,"UTKRAMIT M S BHAGPARWAHA, FARBESGANJ, ARARIA",,,1112,12
12354,"UTKRAMIT M S BELWAAT, ARARIA",,,1112,12
12355,"UTKRAMIT M S KUSHIAR GOAN, ARARIA",,,1112,12
12356,"UTKRAMIT M S DENIA, SIKATI, ARARIA",,,1112,12
12357,"UTKRAMIT M S SAHEBGANJ, NARPATGANJ, ARARIA",,,1112,12
12358,"UTKRAMIT M S DUMARBANNA, NARPATGANJ, ARARIA",,,1112,12
12359,"UTKRAMIT M S GARDHGAMA, NARPATGANJ, ARARIA",,,1112,12
12360,"UTKRAMIT M S BHAWANIPUR, NARPATGANJ, ARARIA",,,1112,12
12361,"UTKRAMIT M S SAMAUL, FARBESGANJ, ARARIA",,,1112,12
12362,"UTKRAMIT M S TIRHUTBITTA, ARARIA",,,1112,12
12363,"UTKRAMIT M S FULSARA, PALASI, ARARIA",,,1112,12
12364,"UTKRAMIT M S DALA, PALASI, ARARIA",,,1112,12
12365,"UTKRAMIT M S DOMOHANA-2, JOKIHAAT, ARARIA",,,1112,12
12366,"UTKRAMIT M S CHIKANI, KURSAKANTA, ARARIA",,,1112,12
12367,"UTKRAMIT M S BORIA, KURSAKANTA, ARARIA",,,1112,12
12368,"UTKRAMIT MADHYAMIK SCHOOL, BAJIDPUR, JOKIHAT, ARARIA",,,1112,12
12369,"UTKRAMIT MADHYAMIK SCHOOL, BHANSHIYA, JOKIHAT, ARARIA",,,1112,12
12370,"UTKRAMIT MADHYAMIK SCHOOL, BAHARBARI, JOKIHAT, ARARIA",,,1112,12
12371,"UTKRAMIT MADHYAMIK SCHOOL, BAGADAHRA, JOKIHAT, ARARIA",,,1112,12
12372,"UTKRAMIT MADHYAMIK SCHOOL, AADI RAMPUR, BHARGAMA, ARARIA",,,1112,12
12373,"UTKRAMIT MADHYAMIK SCHOOL, GAIYARI, ARARIA",,,1112,12
12374,"UTKRAMIT MADHYAMIK SCHOOL, SHAURGAOWN, KURSHAKANTA, ARARIA",,,1112,12
12377,"UTKRAMIT UCHCH MADYAMIK SCHOOL, KACHNA, SIKTI, ARARIA",,,1112,12
12378,"UTKRAMIT MADHYAMIK SCHOOL, MALDWAR, PALASI, ARARIA",,,1112,12
12379,"UTKRAMIT MADHYAMIK SCHOOL, CHANDIPUR, PALASI, ARARIA",,,1112,12
12380,"UTKRAMIT MADHYAMIK SCHOOL, KAROR DIGHLI, PALASI, ARARIA",,,1112,12
12382,"UTKRAMIT MADHYAMIK SCHOOL, CHAURA PARWAH, FORBISGANG, ARARIA",,,1112,12
12383,"UTKRAMIT MADHYAMIK SCHOOL, PIPRA, FORBESGANJ, ARARIA",,,1112,12
12384,"UTKRAMIT MADHYAMIK SCHOOL, RAGHUNATHPUR, BHARGAMA, ARARIA",,,1112,12
12385,"UTKRAMIT MADHYAMIK SCHOOL, CHARAIYA, BHARGAMA, ARARIA",,,1112,12
12386,"UTKRAMIT MADHYAMIK SCHOOL, BHATGAMA, BHARGAMA, ARARIA",,,1112,12
12387,"UTKRAMIT MADHYAMIK SCHOOL, THEKPURA, RANIGANJ, ARARIA",,,1112,12
12388,"UTKRAMIT MADHYAMIK SCHOOL, MAJHUA, RANIGANJ, ARARIA",,,1112,12
12389,"UTKRAMIT MADHYAMIK SCHOOL, DABHRA SHARANPUR, ARARIA",,,1112,12
12390,"UTKRAMIT MADHYAMIK SCHOOL, HALDHAR HAT, KURSAKANTA, ARARIA",,,1112,12
12392,"UTKRAMIT UCHCH MADHYAMIK SCHOOL, JAYNAGAR, BHARGAMA, ARARIA",,,1112,12
12393,"UTKRAMIT UCH MADHYAMIK SCHOOL, MIRDAUL, NARPATGANJ, ARARIA",,,1112,12
12394,"UTKRAMIT MADHYAMIK SCHOOL, SONAPUR, NARPATGANJ, ARARIA",,,1112,12
12395,"UTKRAMIT MADHYAMIK SCHOOL, FATEHPUR, NARPATGANJ, ARARIA",,,1112,12
12396,"UTKRAMIT MADHYAMIK SCHOOL BARDHA NUNIYA TOLA, NARPATGANJ ARARIA",,,1112,12
12397,"UTKRAMIT MADHYAMIK SCHOOL , MAHISHAKOL, ARARIA",,,1112,12
12398,"UTKRAMIT MADHYAMIK SCHOOL, FARASUT, ARARIA",,,1112,12
12399,"UTKRAMIT MADHYAMIK VIDYALYA THENGAPUR, SIKATI, ARARIA",,,1112,12
12400,"UTKARMIT MADHYAMIC VIDYALAYA, GAIRAKI, ARARIA",,,1112,12
12401,"U.M.S MAHALGAON, JOKIHAT, ARARIA",,,1112,12
12402,"U.H.S.PATTI PRANPAT, BHARGAMA, ARARIA",,,1112,12
12501,"HIGH SCHOOL RAHATMINA, ARARIA",,,1112,12
12502,JANTA HIGH SCHOOL CHAKAIHAT ARARIA,,,1112,12
12503,"MAHESHWARI GIRL'S H/S JOGBANI, ARARIA",,,1112,12
12505,H S MIRJAPUR NANDANPUR RANIGANJ ARARIA,,,1112,12
13001,INTER HIGH SCHOOL KISHANGANJ,,,1121,13
13002,NATIONAL HIGH SCHOOL KISHANGANJ,,,1121,13
13003,"RUSSELL HIGH SCHOOL BAHADURGANJ, KISHANGANJ",,,1121,13
13004,"THAKURGANJ HIGH SCHOOL THAKURGANJ, KISHANGANJ",,,1121,13
13005,"HIGH SCHOOL AZADNAGAR CHHATERGACHH, KISHANGANJ",,,1121,13
13006,"KARKUN LAL HIGH SCHOOL ALTAHAT, KISHANGANJ",,,1121,13
13007,"S S HIGH SCHOOL RATANPUR, KISHANGANJ",,,1121,13
13008,"HIGH SCHOOL POWAKHALI, KISHANGANJ",,,1121,13
13009,GIRLS HIGH SCHOOL KISHANGANJ,,,1121,13
13010,"PROJECT HIGH SCHOOL DHANTOLA, KISHANGANJ",,,1121,13
13011,"PROJECT GIRLS HIGH SCHOOL THAKURGANJ, KISHANGANJ",,,1121,13
13012,"N A HIGH SCHOOL GANGIHAT, KISHANGANJ",,,1121,13
13013,"HIGH SCHOOL SONTHA, KISHANGANJ",,,1121,13
13014,"PROJECT AZAD HIGH SCHOOL POTHIA, KISHANGANJ",,,1121,13
13015,"HIGH SCHOOL SINGHIA, KISHANGANJ",,,1121,13
13016,"HIGH SCHOOL TERHAGACHH, KISHANGANJ",,,1121,13
13017,"KISAN HIGH SCHOOL SINGHARI POKHARIA, KISHANGANJ",,,1121,13
13018,"PROJECT GIRLS H/S GHANIFULSARA, KISHANGANJ",,,1121,13
13019,"HIGH SCHOOL TULSIA, KISHANGANJ",,,1121,13
13020,"HIGH SCHOOL BISHANPUR, KISHANGANJ",,,1121,13
13021,"S S HIGH SCHOOL BIBI GANJ, KISHANGANJ",,,1121,13
13022,GOVT S C RESI H/S KISHANGANJ,,,1121,13
13023,"PROJECT GIRLS H/S BAHADURGANJ, KISHANGANJ",,,1121,13
13024,"PROJECT GIRLS HIGH SCHOOL TULSIA, KISHANGANJ",,,1121,13
13025,"PROJ KANYA HIGH SCHOOL POTHIA, KISHANGANJ",,,1121,13
13026,"PROJ KISHAN BALIKA HIGH SCHOOL SONTHA, KISHANGANJ",,,1121,13
13301,"U M S HARIVASA DURGAPUR BANGAMA BAHADURGANJ, KISHANGANJ",,,1121,13
13302,"U M S HARIPOKHR KRANTIGACH GORUKHAL POTHIYA, KISHANGANJ",,,1121,13
13303,"UTKRAMIT M S DHANPURA DERAMARI KOCHDHAMAN, KISHANGANJ",,,1121,13
13304,"UTKRAMIT M S HARWADANGA DIGHALBANK, KISHANGANJ",,,1121,13
13305,"UTKRAMIT M S JANGALIBHITA PATHRIYA THAKURGANJ, KISHANGANJ",,,1121,13
13306,"U H S CHAKLA GHAT, KISHANGANJ",,,1121,13
13307,U H S MAHIN GAON KISHANGANJ,,,1121,13
13308,"M S GACHHIBARA, KISHANGANJ",,,1121,13
13309,"UTTKRAMIT MADHYAMIK SCHOOL BELWA KASHIPUR, KISHANGANJ",,,1121,13
13310,"M S KATHALBARI DIGHALBAIK, KISHANGANJ",,,1121,13
13311,"M S SINGHIMARI DIGHALBAIK, KISHANGANJ",,,1121,13
13312,"M S BAIGNA, KISHANGANJ",,,1121,13
13313,"M S LOHAGARA, KISHANGANJ",,,1121,13
13314,"M S SUHIYA RAHMATPUR, KISHANGANJ",,,1121,13
13315,"M S BELUGARDH, KISHANGANJ",,,1121,13
13316,"M S KAMATI, KISHANGANJ",,,1121,13
13317,"M S BAIRIA, KISHANGANJ",,,1121,13
13318,"M S JARHULIA, KISHANGANJ",,,1121,13
13319,"M S KADHAILI, KISHANGANJ",,,1121,13
13320,"M S DESHIYATOLI, KISHANGANJ",,,1121,13
13321,"M S KATHALBARI BAHADUGANJ, KISHANGANJ",,,1121,13
13322,"M S MAHESHBATHNA, KISHANGANJ",,,1121,13
13323,"M S DHANPAT GANJ, KISHANGANJ",,,1121,13
13324,"M S HALDIKHORA, KISHANGANJ",,,1121,13
13325,"M S MODHO, KISHANGANJ",,,1121,13
13326,"M S BARIJAN, KISHANGANJ",,,1121,13
13327,"M S KADO GAON, KISHANGANJ",,,1121,13
13328,"M S RAJA GAON, KISHANGANJ",,,1121,13
13329,"M S RASIYA, KISHANGANJ",,,1121,13
13330,"M S GALGALIYA, KISHANGANJ",,,1121,13
13331,"M S KALIYAGANJ, KISHANGANJ",,,1121,13
13332,"M S RAIPUR, KISHANGANJ",,,1121,13
13333,"UTTKRAMIT MADHYAMIK SCHOOL MARIA, KISHANGANJ",,,1121,13
13334,UTKRAMIT H/S DALUAHAT POTHIA KISHANGANJ,,,1121,13
13335,"M S DAULA, KISHANGANJ",,,1121,13
13336,UTKRAMIT HIGH SCHOOL KANYA PICHHLA KISHANGANJ,,,1121,13
13337,"UTKRAMIT MADHYAMIK SCHOOL TEUSA, KISHANGANJ",,,1121,13
13338,"UTKRAMIT MADHYAMIK SCHOOL KOCHGARH PURNDHA, KISHANGANJ",,,1121,13
13339,"UTKRAMIT MADHYAMIK SCHOOL TALWARBANDHA, KISHANGANJ",,,1121,13
13340,"UTKRAMIT MADHYAMIK SCHOOL TALGACCH, KISHANGANJ",,,1121,13
13341,"UTKRAMIT MADHYAMIK SCHOOL GANDHARVDANGA, KISHANGANJ",,,1121,13
13342,"UTKRAMIT MADHYAMIK SCHOOL KUWARI, KISHANGANJ",,,1121,13
13343,"UTKRAMIT MADHYAMIK SCHOOL FARABARI, KISHANGANJ",,,1121,13
13344,"UTKRAMIT MADHYAMIK SCHOOL KUSIYARI, KISHANGANJ",,,1121,13
