School Code,School Name,Address,Pincode,Block Code,District Code
32355,"NEW UPGRADED HIGH SCHOOL CHHATAKURUM,KATORIA, BANKA",,,1345,32
32356,"UTKRAMIT MADHYAMIK SCHOOL MATHURAPUR, DHOURIA, BANKA",,,1345,32
32357,"UTKRAMIT MADHYAMIK SCHOOL AHIRO, BANKA",,,1345,32
32358,"UTKRAMIT MADHYAMIK SCHOOL CHALNA, BANKA",,,1345,32
32359,"UTKRAMIT MADHYAMIK SCHOOL TAHIRPUR, BANKA",,,1345,32
32360,"UTKRAMIT MADHYAMIK SCHOOL KURMA, BANKA",,,1345,32
32361,"UTKRAMIT MADHYAMIK SCHOOL SAGUNIA (URDU), BANKA",,,1345,32
32362,"UTKRAMIT MADHYAMIK SCHOOL LILAVARAN, BANKA",,,1345,32
32363,"UTKRAMIT MADHYAMIK SCHOOL GOKULA, BANKA",,,1345,32
32364,"UTKRAMIT MADHYAMIK SCHOOL FATIAPATHAR, BANKA",,,1345,32
32365,"UTKRAM1T MADHYAMIK SCHOOL KOLBUGURG, BANKA",,,1345,32
32366,"UTKRAMIT MADHYAMIK SCHOOL DHAYHARNA MAHGAMA, BANKA",,,1345,32
32367,"UTKRAMIT MADHYAMIK SCHOOL MORAMA BANGAON, BANKA",,,1345,32
32368,"UTKRAMIT MADHYAM1K SCHOOL S1LJORI, BANKA",,,1345,32
32369,"UTKRAMIT MADHYAMIK SCHOOL BASBERWA, BANKA",,,1345,32
32370,"UTKRAMIT MADHYAMIK SCHOOL VARSABAD, BANKA",,,1345,32
32371,"UTKRAMIT MADHYAMIK SCHOOL TAPPADIH, BANKA",,,1345,32
32501,"BALIKA UCHCHA VIDYALAYA KHESAR, BANKA",,,1345,32
32502,"SHRI BISHNUDEO KAPRI HIGH SCHOOL KHAJURI, BANKA",,,1345,32
32503,KANYA UCHHA VIDYALAYA DUMRAMA BANKA,,,1345,32
32504,"B D B H T G H/S DARPA DAMODARPUR, BANKA",,,1345,32
32505,"S B M HIGH SCHOOL BAMDEO BAZAR, BANKA",,,1345,32
32506,"GIRL'S HIGH SCHOOL RANYODHA, BANKA",,,1345,32
32507,"GULABI MAHAT HIGH SCHOOL BALIA MAHARA KHAJUA, BANKA",,,1345,32
32508,"SRI G P JHA GIRL'S HIGH SCHOOL SINGHNAN, BANKA",,,1345,32
32509,"GURU DUKH MOCHAN JANARDAN MANDAL H/S TELIA, BANKA",,,1345,32
32510,"CHANDRA SHEKHAR SINGH ADIWASI H/S SAHU POKHAR, BANKA",,,1345,32
32511,"P N S HIGH SCHOOL TELIA LOUGAIN, BANKA",,,1345,32
32512,"ABADH BIHARI PANDIT HIGH SCHOOL JILEBIA MORE, BANKA",,,1345,32
32513,"HARIJAN ADIWASI HIGH SCHOOL GORA, BANKA",,,1345,32
32514,"HIGH SCHOOL SIKANDARPUR SHYAMBAZAR BOUSHI, BANKA",,,1345,32
32701,"C S SARASWATI VIDYA MANDIR JAGATPUR, BANKA",,,1345,32
32702,"N.D.S. SARASWATI VIDYAMANDIR PUNASIA, BANKA",,,1345,32
41001,ZILA SCHOOL SAHARSA,,,1171,41
41002,GOVT GIRLS HIGH SCHOOL SAHARSA,,,1171,41
41003,MANOHAR HIGH SCHOOL SAHARSA,,,1171,41
41004,A N S S HIGH SCHOOL SAHARSA,,,1171,41
41005,"MANOHAR HIGH SCHOOL BAIJNATHPUR, SAHARSA",,,1171,41
41006,"G S HIGH SCHOOL SCURBAZAR, SAHARSA",,,1171,41
41007,"HIGH SCHOOL SCURBAZAR, SAHARSA",,,1171,41
41008,"S HARIBALLABH INST SONBARSA, SAHARSA",,,1171,41
41009,"S C H/S CHANDISTHAN BIRATPUR, SAHARSA",,,1171,41
41010,"M M D HIGH SCHOOL AMARPUR, SAHARSA",,,1171,41
41011,"GOVT RES HIGH SCHOOL AMARPUR, SAHARSA",,,1171,41
41012,"S S HIGH SCHOOL NAWAHATTA, SAHARSA",,,1171,41
41013,"KALAWATI HIGH SCHOOL BANGAON, SAHARSA",,,1171,41
41014,"FUL DAI GIRLS HIGH SCHOOL BANGAON, SAHARSA",,,1171,41
41015,"HIGH SCHOOL CHAINPUR PARARI, SAHARSA",,,1171,41
41016,"GIRLS HIGH SCHOOL PARARI CHAINPUR, SAHARSA",,,1171,41
41017,"A D P J HIGH SCHOOL MAHISHI, SAHARSA",,,1171,41
41018,"M S D HIGH SCHOOL MENHA, SAHARSA",,,1171,41
41019,"S N K HIGH SCHOOL LAGMA, SAHARSA",,,1171,41
41020,"S D HIGH SCHOOL GOLMA, SAHARSA",,,1171,41
41021,"R J HIGH SCHOOL PIPRA, SAHARSA",,,1171,41
41022,"T HIGH SCHOOL JAMHARA, SAHARSA",,,1171,41
41023,"S HIGH SCHOOL SABAILA, SAHARSA",,,1171,41
41024,"K D HIGH SCHOOL DHARAHRA MURADPUR, SAHARSA",,,1171,41
41025,"HIGH SCHOOL DHABOULI, SAHARSA",,,1171,41
41026,"P HIGH SCHOOL PANCHAGACHIYA, SAHARSA",,,1171,41
41027,"GANGA HIGH SCHOOL MAINA, SAHARSA",,,1171,41
41028,"M L B HIGH SCHOOL KASHNAGAR, SAHARSA",,,1171,41
41029,"S D HIGH SCHOOL SIHAUL, SAHARSA",,,1171,41
41030,"HIGH SCHOOL BARGOAN, SAHARSA",,,1171,41
41031,"R D HIGH SCHOOL BHADDI, SAHARSA",,,1171,41
41032,"B HIGH SCHOOL RAKIYA, SAHARSA",,,1171,41
41033,"HIGH SCHOOL GANDAUL, SAHARSA",,,1171,41
41034,"K A HIGH SCHOOL MAHISARHO BALUAHA, SAHARSA",,,1171,41
41035,"HIGH SCHOOL SAHSAUL, SAHARSA",,,1171,41
41036,V K S S HIGH SCHOOL GANJALA SAHARSA,,,1171,41
41037,"P G HIGH SCHOOL NOWAHATTA, SAHARSA",,,1171,41
41038,"P G HIGH SCHOOL MAHISHI, SAHARSA",,,1171,41
41039,"PROJECT G HIGH SCHOOL CHANDAUR, SAHARSA",,,1171,41
41040,GOVT GIRLS H/S PURAB BAZAR SAHARSA,,,1171,41
41041,"HIGH SCHOOL SIMRI BAKHTIYARPUR, SAHARSA",,,1171,41
41042,"A HIGH SCHOOL BALWAHAT, SAHARSA",,,1171,41
41043,"M N D HIGH SCHOOL CHAKBHARO, SAHARSA",,,1171,41
41044,"M M D HIGH SCHOOL SALKHUA, SAHARSA",,,1171,41
41045,"R P R HIGH SCHOOL BAGHWA, SAHARSA",,,1171,41
41046,"ISLAMIA H/S SIMRI BAKHTIYARPUR, SAHARSA",,,1171,41
41047,"D D HIGH SCHOOL SARDIHA, SAHARSA",,,1171,41
41048,"KOSHI HIGH SCHOOL KABIRA DHAP, SAHARSA",,,1171,41
41049,"PG HIGH SCHOOL SALKHUA, SAHARSA",,,1171,41
41050,"P G HIGH SCHOOL SIMRI BAKHTIYARPUR, SAHARSA",,,1171,41
41051,O B C KANYA H S SAHARSA,,,1171,41
41301,"UTKRAMIT M S KEDALIPATTI KEDALI NAVHATTA, SAHARSA",,,1171,41
41302,"UTKRAMIT M S JHARA MAHISI, SAHARSA",,,1171,41
41303,"UTKRAMIT M S KHAJURI SAOUR BAZAR, SAHARSA",,,1171,41
41304,"UTKRAMIT M S PIPARA WAGEWA GAURDAHA SALKHUA, SAHARSA",,,1171,41
41305,"UTKRAMIT M S GHOGHASAM SIMARI BAKHATIYARPUR, SAHARSA",,,1171,41
41306,"UTKRAMIT M S PANCHLAKH MEKAMA SONBARSA, SAHARSA",,,1171,41
41307,"MAHAVIR UTKRAMIT M S DHAMSENA SAOURBAZAR, SAHARSA",,,1171,41
41308,"UTKRAMIT M S ITHARI BANMA ITHARI, SAHARSA",,,1171,41
41309,"V M VIDAIYA BHAGWANPUR,BANMA ITAHARI, SAHARSA",,,1171,41
41310,"UTKRAMIT MADHYAMIK SCHOOL DHANUPRA, SAHARSA",,,1171,41
41311,"UTKRAMIT MADHYAMIK SCHOOL SAMHAR, SAHARSA",,,1171,41
41312,"UTKRAMIT MADHYAMIK SCHOOL PARTAHA BARHARA, SAHARSA",,,1171,41
41313,"UTKRAMIT MADHYAMIK SCHOOL KANDAHA, MAHISI, SAHARSA",,,1171,41
41314,"UTKRAMIT MADHYAMIK SCHOOL THANWAR, MAHISI, SAHARSA",,,1171,41
41315,"UTKRAMIT MADHYAMIK SCHOOL ALANI, SALKHUA, SAHARSA",,,1171,41
41316,"UTKRAMIT M S KHOCHARDEVA, SALKHUA, SAHARSA",,,1171,41
41317,"UTKRAMIT M S PARASBANNI, BANMA ITAHARI, SAHARSA",,,1171,41
41318,"UTKRAMIT M S KISHANPUR, PATARGHAT, SAHARSA",,,1171,41
41319,"UTKRAMIT MADHYAMIK SCHOOL GONDRAM,SONBARSA, SAHARSA",,,1171,41
41320,"UTKRAMIT MADHYAMIK SCHOOL KOPA, SONBARSA, SAHARSA",,,1171,41
41321,"UTKRAMIT MADHYAMIK SCHOOL KHAJURAHA, SONBERSA, SAHARSA",,,1171,41
41322,"UTKRAMIT MADHYAMIK SCHOOL ARSI, SONBARSA, SAHARSA",,,1171,41
41323,"UTKRAMIT MADHYAMIK SCHOOL BELWARA, SIMARI, SAHARSA",,,1171,41
41324,"UTKRAMIT MADHYAMIK SCHOOL TELHAR, MAHISI, SAHARSA",,,1171,41
41325,"GIRLS UTKRAMIT M S KASIMPUR, NAVHATTA, SAHARSA",,,1171,41
41326,"UTKRAMIT MADHYAMIK SCHOOL SULINDABAD, KAHARA, SAHARSA",,,1171,41
41327,"UTKRAMIT M S KATHDUMAR, SIMARI BAKHTYARPUR, SAHARSA",,,1171,41
41328,"UTKRAMIT MADHYAMIK SCHOOL PASTPAR, PATARGHAT, SAHARSA",,,1171,41
41329,"UTKRAMIT MADHYAMIK SCHOOL MANGRAUNI, MAHISI, SAHARSA",,,1171,41
41330,"UTKRAMIT MADHYAMIK SCH BIHRA, SATTAR KATAIYA, SAHARSA",,,1171,41
41331,"UTKRAMIT MADHYAMIK SCHOOL, RAMPUR, SAUR BAZAR, SAHARSA",,,1171,41
41332,"UTKRAMIT MADHYAMIK SCHOOL, RUPAULI, SAUR BAZAR, SAHARSA",,,1171,41
41333,"UTKRAMIT MADHYAMIK SCHOOL, VIJALPUR, SATTARKATAIYA, SAHARSA",,,1171,41
41334,"UTKRAMIT MADHYAMIK SCHOOL, GOSPUR, SALKHUA,SAHARSA",,,1171,41
41335,"UTKRAMIT MADHYAMIK SCHOOL, BASUDEVA, KAHRA, SAHARSA",,,1171,41
41336,"UTKRAMIT ANNANPURNA MADHYAMIK SCHOOL, BARAHI, NAVHATTA, SAHARSA",,,1171,41
41337,"UTKRAMIT UCHCH MADHYAMIK SCHOOL, PATARGHAT, SAHARSA",,,1171,41
41338,"UTKRAMIT MADHYAMIK SCHOOL, NONAITI, SONBARSHA, SAHARSA",,,1171,41
41339,"UTKRAMIT MADHYAMIK SCHOOL, DHANCHOHA, SAURBAZAR, SAHARSA",,,1171,41
41340,"UTKRAMIT MADHYAMIK SCHOOL, MAHESHPUR, SAURBAZAR, SAHARSA",,,1171,41
41341,"UTKRAMIT MADHYAMIK SCHOOL, KAMALJARI, PATARGHAT, SAHARSA",,,1171,41
41342,"UTKRAMIT MAUNI UCHH MADHYAMIK SCHOOL, KAHRA, PATARGHAT, SAHARSA",,,1171,41
41343,"UTKRAMIT UCHH MADHYAMIK SCHOOL SIMRI, SIMRI BAKHTIYARPUR, SAHARSA",,,1171,41
41344,"UTKRAMIT UCHH MADHYAMIK SCHOOL, MAHPURA, MAHISHI, SAHARSA",,,1171,41
41345,"UTKRAMIT UCHH MADHYAMIK SCHOOL, ORIYA RAMAUTI, NAVHATTA SAHARSA",,,1171,41
41346,"UTKRAMIT UCHH MADHYAMIK SCHOOL MURLI BASANTPUR SATTARKATIAH, SAHARSA",,,1171,41
41347,"UTKRAMIT UCHH MADHYAMIK VIDYALYA BALETHA RAMPUR, SAHARSA",,,1171,41
41348,"UTKRAMIT UCHH MADHYAMIK VIDYALYA ENI, SAHARSA",,,1171,41
41349,"UTKRAMIT UCHCH MADHYAMIK VIDYALAYA UTESHRA, SALKHUA, SAHARSA",,,1171,41
41350,"UTKARMIT UCHCH MADHYAMIC VIDYALAYA, MANGWAR , SONVARSHA , SAHARASA",,,1171,41
41351,"UTKARMIT UCHCH MADHYAMIC VIDYALAYA, TAMKULHA, SONVARSHA , SAHARASA",,,1171,41
41352,"UTKARMIT UCHCH MADHYAMIC VIDYALAYA, RAIPURA BHORHA , SAHARASA",,,1171,41
41353,"UTKARMIT UCHCH MADHYAMIC VIDYALAYA, TARIYAMA , SAHARASA",,,1171,41
41354,"UTKARMIT UCHCH MADHYAMIC VIDYALAYA, MAHARASH , SAHARASA",,,1171,41
41355,"UTKARMIT UCHCH MADHYAMIC VIDYALAYA, KHAJURI , SAHARASA",,,1171,41
41356,"UTKRAMIT UCHCH MADHYAMIK VIDYALAY SATTAUR, NAUHATTA, SAHARSA",,,1171,41
41357,"UTKRAMIT UCHCH MADHYAMIK VIDYALAY, NADO, SOURBAZAR, SAHARSA",,,1171,41
41501,"SIDDIQUA GIRL'S H/S PAHLAM, SAHARSA",,,1171,41
41502,SHOBHA RAMBAHADUR H/S RAJANPUR SAHARSA,,,1171,41
41503,"SUMITRA DEVI GIRL'S H/S BARGAON, SAHARSA",,,1171,41
41504,"JANTA H/S KACHRA KADHAIYA, SAHARSA",,,1171,41
41505,"BANWARI SINGH H/S RAMPUR, SAHARSA",,,1171,41
41506,"MAHANTH DAHAUR DAS KABIR H/S TELWA MAHISHI, SAHARSA",,,1171,41
41507,"VINAY PRABHA GIRL'S H/S CHAKBHARO, SAHARSA",,,1171,41
41508,"MAHADEV MANDAL RAMKRISHAN DAS H/S BALHA, SAHARSA",,,1171,41
41509,"HIGH SCHOOL BHAROULI DHAKJARI, SAHARSA",,,1171,41
41510,"MANKU MANDH HIGH SCHOOL SATTAR KATAIYA, SAHARSA",,,1171,41
41511,"ARUN BISHWANATH HIGH SCHOOL ARAN, SAHARSA",,,1171,41
41512,"SHITAL KOSHI HIGH SCHOOL BARAHSHER, SAHARSA",,,1171,41
41513,KOSHI HIGH SCHOOL KOSHI COLONY SAHARSA,,,1171,41
42001,WILLIAMS HIGH SCHOOL SUPAUL,,,1101,42
42002,R B B GIRLS HIGH SCHOOL SUPAUL,,,1101,42
42003,T C H/SH CHAKLA NIRMALI SUPAUL,,,1101,42
42004,"HAZARI HIGH SCHOOL GHURAB GARH, SUPAUL",,,1101,42
42005,"TEJENDRA HIGH SCHOOL BARUARY, SUPAUL",,,1101,42
42006,"J K HIGH SCHOOL RATAULI JARAULI, SUPAUL",,,1101,42
42007,"HARIJAN HIGH SCHOOL SIHE, SUPAUL",,,1101,42
42008,"J P L HIGH SCHOOL BASAHA, SUPAUL",,,1101,42
42009,"L K P H S BANAINIAN BALTHARWA, SUPAUL",,,1101,42
42010,"M L K HIGH SCHOOL CHAUGHARA, SUPAUL",,,1101,42
42011,"GANDHI HIGH SCHOOL RAJPUR, SUPAUL",,,1101,42
42012,"BHAGI RATH HIGH SCHOOL NIRMALI, SUPAUL",,,1101,42
42013,"MAHADEO HIGH SCHOOL NOWA BAKHAR, SUPAUL",,,1101,42
42014,"S D SKB HIGH SCHOOL HARDI CHAUGHARA, SUPAUL",,,1101,42
42015,"HIGH SCHOOL BINA BABHANGAMA ANDOULI, SUPAUL",,,1101,42
42016,"S W HIGH SCHOOL MOUJAHA, SUPAUL",,,1101,42
42017,"HIGH SCHOOL KISHANPUR, SUPAUL",,,1101,42
42018,"HIGH SCHOOL SUKHPUR, SUPAUL",,,1101,42
42019,"S D HIGH SCHOOL PIPRA BAZAR, SUPAUL",,,1101,42
42020,"B G HIGH SCHOOL BHAPTIYAHI, SUPAUL",,,1101,42
42022,"PROJECT GIRLS H S PIPRA BAZAR, SUPAUL",,,1101,42
42023,"GOVT HIGH SCHOOL BIRPUR, SUPAUL",,,1101,42
42024,"L K A HIGH SCHOOL BIRPUR, SUPAUL",,,1101,42
42025,"L S HIGH SCHOOL SIMRAHI BAZAR, SUPAUL",,,1101,42
42026,"G HIGH SCHOOL BARMOTRA, SUPAUL",,,1101,42
42027,"J B M A HIGH SCHOOL KARJAIN, SUPAUL",,,1101,42
42028,"P L N HIGH SCHOOL RATANPUR, SUPAUL",,,1101,42
42029,"L V V GIRLS GANPATGANJ, SUPAUL",,,1101,42
42030,"PUBLIC HIGH SCHOOL PRATAPGANJ, SUPAUL",,,1101,42
42031,"S V K GIRLS PRATAPGANJ, SUPAUL",,,1101,42
42032,"S S H R HIGH SCHOOL GANPATGANJ, SUPAUL",,,1101,42
42033,"M L HIGH SCHOOL DAULATPUR, SUPAUL",,,1101,42
42034,"HAZI NAJIBULLAH H/S SURJAPUR, SUPAUL",,,1101,42
42035,"HIGH SCHOOL TRIBENIGANJ, SUPAUL",,,1101,42
42036,"HIGH SCHOOL KORIAPATTI, SUPAUL",,,1101,42
42037,"R K B A HIGH SCHOOL TRIBENIGANJ, SUPAUL",,,1101,42
42038,"HIGH SCHOOL JADIA, SUPAUL",,,1101,42
42039,"L N L N P H S TRIBENIGANJ, SUPAUL",,,1101,42
42040,"K K HIGH SCHOOL HARIHARPUR, SUPAUL",,,1101,42
42041,"R S L N VIDYAMANDIR BALUA BAZAR, SUPAUL",,,1101,42
42042,"S S HIGH SCHOOL SURPATGANJ, SUPAUL",,,1101,42
42043,"S S HIGH SCHOOL CHARNE, SUPAUL",,,1101,42
42044,"HIGH SCHOOL NIRMALI, SUPAUL",,,1101,42
42045,"S M H/S BARHARA MANOHARPATTI, SUPAUL",,,1101,42
42046,"LALESHWAR NATH HIGH SCHOOL MARAUNA, SUPAUL",,,1101,42
42047,"SRI ANANT H S GANAURA PARSAUNI, SUPAUL",,,1101,42
42048,"NATHU KOSHI HIGH SCHOOL DAGMARA, SUPAUL",,,1101,42
42049,"JAGESHWAR HIGH SCHOOL KUNAULI, SUPAUL",,,1101,42
42050,"PROJECT GIRLS HIGH SCHOOL BELHI, SUPAUL",,,1101,42
42051,"PROJECT GIRLS HIGH SCHOOL NIRMALI, SUPAUL",,,1101,42
42052,"PRASTAWIT PAVITRA HRIDAY H S LATAUNA, SUPAUL",,,1101,42
42053,"DR. AMBEDKAR H/S DAPARKHA TRIVENIGANJ, SUPAUL",,,1101,42
42301,"UTKRAMIT M S BALBHADRAPUR BASANTPUR, SUPAUL",,,1101,42
42302,"UTKRAMIT M S MADHUBANI CHATAPUR, SUPAUL",,,1101,42
42303,"LAKHICHAND SAHU UTKRAMIT M S HARRAHA RAGHOPUR, SUPAUL",,,1101,42
42304,"UTKRAMIT M S PHUWARIYA ANDAULI KISHANPUR, SUPAUL",,,1101,42
42305,"MIDDLE SCHOOL RAMNAGAR PIPRA, SUPAUL",,,1101,42
42306,UTKRAMIT M S KARIHO SUPAUL,,,1101,42
42307,"UTKRAMIT M S PARIKOCH MARAUNA, SUPAUL",,,1101,42
42308,"UTKRAMIT M S KUMMARI KUMYAHI SIMARIYA, SUPAUL",,,1101,42
42309,UTKRAMIT MADHYAMIK SCHOOL BASBITTI SUPAUL,,,1101,42
42310,"UTKRAMIT MADHYAMIK SCHOOL KALIGANJ, SUPAUL",,,1101,42
42311,"UTKRAMIT MADHYAMIK SCHOOL SISAUNI, SARIGARDH, SUPAUL",,,1101,42
42312,"UTKRAMIT M SCH SUKHASHAN, SARIGARDH, SUPAUL",,,1101,42
42314,"UTKRAMIT MADHYAMIK SCHOOL RASUAAR, MARAUNA, SUPAUL",,,1101,42
42315,"UTKRAMIT MADHYAMIK SCHOOL HARARI, MARAUNA SUPAUL",,,1101,42
42317,"UTKRAMIT M SCH PARSA GARHI, TRIBENIGANJ, SUPAUL",,,1101,42
42320,"UTKRAMIT MADHYAMIK SCHOOL PARMANANDPUR, BASANTPUR, SUPAUL",,,1101,42
42321,"UTKRAMIT M SCH BHIMPUR, TRIVENIGANJ, SUPAUL",,,1101,42
42322,"UTKRAMIT M SCH BELA TOLA DOMUHAN, NIRMALI, SUPAUL",,,1101,42
42323," LATE PURAN SINGH U M S MALAHNI, SUPAUL",,,1101,42
42324,"J P M U M S BAISA, SARAIGARH BHAPTIYAHI, SUPAUL",,,1101,42
42325,"UTKRAMIT MADHYAMIK SCHOOL MURLI, SUPAUL",,,1101,42
42326,"UTKRAMIT MADHYAMIK SCHOOL MARAUNA,SUPAUL",,,1101,42
42327,"UTKRAMIT H SCHOOL SAROJA BELA, MARAUNA SUPAUL",,,1101,42
42328,"UTKRAMIT M SCH TULAPATTI, KISHANPUR, SUPAUL",,,1101,42
42329,"UTKRAMIT MADHYAMIK SCHOOL LAUKAHA, SUPAUL",,,1101,42
42330,"UTKRAMIT M SCH BRAHAMBULAK DUBIYAHI, KISHANPUR, SUPAUL",,,1101,42
42332,"UTKRAMIT M SCH RATANSAAR, CHHATA PUR, SUPAUL",,,1101,42
42333,"U M SCH PIPARA KHURD,SARAIGARH BHAPTIYAHI, SUPAUL",,,1101,42
42334,"UTKRAMIT MADHYAMIK SCHOOL GOANHA, TRIVENIGANJ, SUPAUL",,,1101,42
42335,"UTKRAMIT MADHYAMIK SCHOOL KATAHI, CHHATAPUR, SUPAUL",,,1101,42
42336,"UTKRAMIT M SCH BANEILIPATTI, BASANTPUR, SUPAUL",,,1101,42
42337,"UTKRAMIT M SCH GIRDHARPATTI, CHHATAPUR, SUPAUL",,,1101,42
42338,"UTKRAMIT MADHYAMIK SCHOOL BAIRO, SUPAUL",,,1101,42
42339,"UTKRAMIT MADHYAMIK SCHOOL BASULI, BASANTPUR, SUPAUL",,,1101,42
42340,"UTKRAMIT M SCH PARSAHI HAT TRIVENIGANJ, SUPAUL",,,1101,42
42341,"UTKRAMIT M SCH PANDEYPATTI, TRIVENIGANJ, SUPAUL",,,1101,42
42342,"UTKRAMIT GIRLS M SCH BARA,SUPAUL",,,1101,42
42343,"UPGRADED KANYA H S RAMPUR, SUPAUL",,,1101,42
42344,"UTKRAMIT M SCH MAHADDIPUR, CHHATAPUR, SUPAUL",,,1101,42
42345,"UTKRAMIT MADHYAMIK SCHOOL SAMDA, SUPAUL",,,1101,42
42346,"UTKRAMIT M SCH MIRJAWA, TRIVENIGANJ, SUPAUL",,,1101,42
42347,"UTKRAMIT MADHYAMIK SCHOOL MAUN,TRIVENIGANJ, SUPAUL",,,1101,42
42348,"UTKRAMIT MADHYAMIK SCHOOL NIRMALI,BASANTPUR, SUPAUL",,,1101,42
42349,"UTKRAMIT MADHYAMIK SCHOOL DHADHA, BASANTPUR, SUPAUL",,,1101,42
42350,"UTKRAMIT MADHYAMIK SCHOOL TEKUNA, PRATAPGANJ, SUPAUL",,,1101,42
42351,"U H S KAMALDAHA,KISHANPUR, SUPAUL",,,1101,42
42352,"UTKRAMIT MADHYAMIK SCHOOL HIRDAYNAGAR, SUPAUL",,,1101,42
42353,"UTKRAMIT MADHYAMIK SCHOOL KORIYAPATTI DEVIPUR, SUPAUL",,,1101,42
42354,"UTKRAMIT MADHYAMIK SCHOOL HULAS, SUPAUL",,,1101,42
42355,"UTKRAMIT MADHYAMIK SCHOOL SHEKHTOLA LAXMINIA, SUPAUL",,,1101,42
42356,"UTKRAMIT MADHYAMIK SCHOOL PATERWA, SUPAUL",,,1101,42
42357,"UTKRAMIT MADHYAMIK SCHOOL PARSA URDU, SUPAUL",,,1101,42
42358,"UTKRAMIT MURLI MANOHAR MADHYAMIK SCHOOL BARAIL, SUPAUL",,,1101,42
42359,"UTKRAMIT MADHYAMIK SCHOOL BAURAHA HINDI, SUPAUL",,,1101,42
42360,"UTKRAMIT MADHYAMIK SCHOOL MOTIPUR, SUPAUL",,,1101,42
42361,"UTKRAMIT MADHYAMIK SCHOOL JHALLA DUMARI, SUPAUL",,,1101,42
42362,"UTKRAMIT MADHYAMIK SCHOOL VISHANPUR CHOUDHARY, SUPAUL",,,1101,42
42363,"RAMNATH UTKRAMIT MADHYAMIK SCHOOL GAOUSPUR, SUPAUL",,,1101,42
42364,"UTKRAMIT MADHYAMIK SCHOOL LALGANJ, SUPAUL",,,1101,42
42365,UTKRAMIT UCHH MADHYAMIK SCHOOL LALGANJ TILATHI CHHATAPUR SUPAUL,,,1101,42
42366,UKRAMIT UCHH MADHYAMIK SCHOOL PILUWAHA TRIVENIGANJ SUPAUL,,,1101,42
42367,PALAT UTKRAMIT UCHH MADHYAMIK SCHOOL MAHESHUA TRIVENIGANJ SUPAUL,,,1101,42
42368,"UTKRAMIT UCHH MADHYAMIK SCHOOL BHAGWANPUR HARIHARPATTI TRIVENIGANJ SUAPUL, SUPAUL",,,1101,42
42369,UTKRAMIT UCHH MADHYAMIK SCHOOL NANHI TOLA RAMPUR CHHATAPUR SUPAUL,,,1101,42
42370,UTKRAMIT UCHH MADHYAMIK SCHOOL CHAKLA DAGRIYA CHHATAPUR SUPAUL,,,1101,42
42371,UTKRAMIT UCHH MADHYAMIK SCHOOL KATHARA KHATWETOLA KATHARA CHHATAPUR SUPAUL,,,1101,42
42372,UTKRAMIT UCHH MADHYAMIK SCHOOL LAXMIPUR WEST LAXMIPURKHUTI CHHATAPUR SUPAUL,,,1101,42
42373,MAUJI UTKRAMIT UCHH MADHYAMIK SCHOOL DIWANGANJ CHILAUNI DAKSHIN PRATAPGANJ SUPAUL,,,1101,42
42374,UTKRAMIT UCHH MADHYAMIK SCHOOL CHANDAPIPAR SARAYGARH BHAPTIYAHI SUPAUL,,,1101,42
42375,BINOVA UTKRAMIT UCHH MADHYAMIK SCHOOL JARAILA THALHA GADHIYA UTTAR TRIVENIGANJ SUPAUL,,,1101,42
42376,UTKRAMIT UCHH MADHYAMIK SCHOOL PARASARMA PARSARMA PARSAUNI SUPAUL,,,1101,42
42377,UTKRAMIT UCHH MADHYAMIK SCHOOL LAUDH SUPAUL,,,1101,42
42378,UTKRAMIT UCHH MADHYAMIK SCHOOL DABHARI BERIYA SUPAUL,,,1101,42
42379,UTKRAMIT UCHH MADHYAMIK SCHOOL DHAURE KATAIYA BALHA SUPAUL,,,1101,42
42380,UTKRAMIT UCHH MADHYAMIK SCHOOL SIMRI CHHITAHI HANUMAN NAGAR SARAYGARH BHAPTIYAHI SUPAUL,,,1101,42
42381,UTKRAMIT UCHH MADHYAMIK SCHOOL GIRIPATTI RAGHOPUR SUPAUL,,,1101,42
42382,UTKRAMIT UCHH MADHYAMIK SCHOOL BYASI RAGHOPUR SUPAUL,,,1101,42
42383,KHUBLAL UTKRAMIT UCHH MADHYAMIK SCHOOL RAMVISHANPUR RAGHOPUR SUPAUL,,,1101,42
42384,ADARSH UTKRAMIT UCHH MADHYAMIK SCHOOL ABHUAR HARHEYA KISHANPUR SUPAUL,,,1101,42
42385,UTKRAMIT UCHH MADHYAMIK SCHOOL SISAUNI MARAUNA SUPAUL,,,1101,42
42386,U.H.S.CHAINPUR,,,1101,42
42387,UHS GHIVAHA,,,1101,42
42388,U.H.S.KESTA ,,,1101,42
42389,U.H.S.RAJESWARI ,,,1101,42
42390,U.H.S JIWACHHPUR,,,1101,42
42392,U.H.S BHWANIPTI,,,1101,42
42393,U.H.S. PATHRA,,,1101,42
42394,U.H.S.GOVINDPUR,,,1101,42
42395,U.H.S.VISANPUR,,,1101,42
42396,"UTKRAMIT UCHCH MADHYAMIK VIDYALAYA TULAPATTI, SUPAUL",,,1101,42
42397,U.H.S. BASHA,,,1101,42
42398,UTKRAMIT UCHCH MADHYAMIK VIDYALAYA KATAIYA GOTH,,,1101,42
42400,U.H.S NRHI,,,1101,42
42401,U.H.S.MACHA,,,1101,42
42402,U.H.S.BATAHWA,,,1101,42
42404,"UTKRAMIT UCHCH MADHYAMIK VIDYALAY GOPALPUR, SIRE, SUPAUL",,,1101,42
42405,U.H.S.TITUAHA,,,1101,42
42406,BOKU.U.H.S.AMHA,,,1101,42
42407,U.H.S. PRSONI,,,1101,42
42408,U.H.S.SHAPUR,,,1101,42
42410,U.H.S. KATAIYA,,,1101,42
42411,URDU.U.H.S.BAGHELI,,,1101,42
42412,U.H.S BABANGAWO,,,1101,42
42413,"BANWARI U.H.S THUMHA, SUPAUL",,,1101,42
42414,U.H.S JHKHARGAD,,,1101,42
42415,U.H.S.PARSAMADHO,,,1101,42
42501,"SRI SHANKAR JHAULI H/S GHOGHARARIYA PARIKONCH, SUPAUL",,,1101,42
42502,SUGAWATI MAHESHWARY H/S LAUKAHA SUPAUL,,,1101,42
42503,"SAKHAN YADAV HIGH SCHOOL MAHESHPUR, SUPAUL",,,1101,42
42504,"HARI NANDAN HARIJAN AWASIYA H/S TEIBENIGANJ, SUPAUL",,,1101,42
42505,"KOSHI HIGH SCHOOL BHIMNAGAR, SUPAUL",,,1101,42
42506,HIGH SCHOOL KARNPUR SUPAUL,,,1101,42
42507,"JANTA HIGH SCHOOL MEHA SIMAR, SUPAUL",,,1101,42
42702,S R Y S S SCHOOL KISHANPUR SUPAUL,,,1101,42
43001,S N P M INTER HIGH SCHOOL MADHEPURA,,,1158,43
43002,RAS BIHARI HIGH SCHOOL MADHEPURA,,,1158,43
43003,T P COLLEGIATE MADHEPURA,,,1158,43
43004,R K GIRLS HIGH SCHOOL MADHEPURA,,,1158,43
43005,"S A HIGH SCHOOL BHANTEKTHI, MADHEPURA",,,1158,43
43006,"SRI DURGA HIGH SCHOOL GHAILARD, MADHEPURA",,,1158,43
43007,A HIGH SCHOOL SUKHASAN CHAKLA MADHEPURA,,,1158,43
43008,"S B B HIGH SCHOOL GODHAILA, MADHEPURA",,,1158,43
43009,"YOGENDRA HIGH SCHOOL MURHO, MADHEPURA",,,1158,43
43010,"B L INTER SCHOOL MURLIGANJ, MADHEPURA",,,1158,43
43011,"B MURHO HIGH SCHOOL MURLIGANJ, MADHEPURA",,,1158,43
43012,"A P C HIGH SCHOOL MURLIGANJ, MADHEPURA",,,1158,43
43013,"ADARSH HIGH SCHOOL BABHANGAMA, MADHEPURA",,,1158,43
43014,"R S HIGH SCHOOL TAMOUT PARSA, MADHEPURA",,,1158,43
43015,"GOVT HIGH SCHOOL AMARI, MADHEPURA",,,1158,43
43016,"M D HIGH SCHOOL SINGHESHWAR, MADHEPURA",,,1158,43
43017,"D S SUKHASAN MANHARA, MADHEPURA",,,1158,43
43018,"KARI ANANTA H/S MADHAILI BAZAR, MADHEPURA",,,1158,43
43019,"PARASMANI HIGH SCHOOL BABHANI, MADHEPURA",,,1158,43
43020,"H R HIGH SCHOOL LALPUR SAROPATTI, MADHEPURA",,,1158,43
43021,"SIYARAM HIGH SCHOOL JAGBANI, MADHEPURA",,,1158,43
43022,"SRI GORELAL HIGH SCHOOL KABIYAHI, MADHEPURA",,,1158,43
43023,"M H HIGH SCHOOL RANI POKHAR, MADHEPURA",,,1158,43
43024,"M M HIGH SCHOOL KUMAR KHAND, MADHEPURA",,,1158,43
43025,"JAWAHAR HIGH SCHOOL RAMNAGARBELA, MADHEPURA",,,1158,43
43026,"D N HIGH SCHOOL RANI PATTISUKHASAN, MADHEPURA",,,1158,43
43027,"MAHABIR (R) H/S TIKULIYA BISANPUR SUNDAR, MADHEPURA",,,1158,43
43028,"PROJECT GIRLS H/S SINGHESHWAR, MADHEPURA",,,1158,43
43029,"PROJECT GIRLS H/S KUMARKHAND, MADHEPURA",,,1158,43
43030,"N K M H S SHAH ALAMNAGAR, MADHEPURA",,,1158,43
43031,"HIGH SCHOOL KHAPUR, MADHEPURA",,,1158,43
43032,"JAI LAL HIGH SCHOOL SAPARDAH, MADHEPURA",,,1158,43
43033,"S N P M HIGH SCHOOL KHURHAN, MADHEPURA",,,1158,43
43034,"JANTA HIGH SCHOOL CHOUSA, MADHEPURA",,,1158,43
43035,"SRI BASUDEO HIGH SCHOOL NAYATOLA, MADHEPURA",,,1158,43
43036,"GANDHI HIGH SCHOOL ARAJPUR, MADHEPURA",,,1158,43
43037,"R V M HIGH SCHOOL KALASAN, MADHEPURA",,,1158,43
43038,"S B J S H/S UDA KISHANGANJ, MADHEPURA",,,1158,43
43039,"HIGH SCHOOL BIHARIGANJ, MADHEPURA",,,1158,43
43040,"J J GIRLS HIGH SCHOOL BIHARIGANJ, MADHEPURA",,,1158,43
43041,"P A HIGH SCHOOL GAMAIL, MADHEPURA",,,1158,43
43042,"MADHU RAM HIGH SCHOOL GOALPARA, MADHEPURA",,,1158,43
43043,"K P N HIGH SCHOOL PIPRAKARAUTI, MADHEPURA",,,1158,43
43044,"S S HIGH SCHOOL KHARA, MADHEPURA",,,1158,43
43045,"HIGH SCHOOL SHAHJADPUR, MADHEPURA",,,1158,43
43046,"B S V M H/S HATHIONDHA BIHARIGANJ, MADHEPURA",,,1158,43
43047,"J M K L M HIGH SCHOOL PHULAUT, MADHEPURA",,,1158,43
43048,"V S PROJECT GIRLS H/S ALAM NAGAR, MADHEPURA",,,1158,43
43049,"S R J S K HIGH SCHOOL TULSIA, MADHEPURA",,,1158,43
43050,"RAM HANS HIGH SCHOOL CHATRA, MADHEPURA",,,1158,43
43051,"G C J R H/S LAXMIPUR KUSHTHAN, MADHEPURA",,,1158,43
43052,"PROJECT KANYA H S MURLIGANJ, MADHEPURA",,,1158,43
43053,"GOVT. SC. GIRLS R H/S MURLIGANG, MADHEPURA",,,1158,43
43301,"UTKRAMIT M S BARGAON ALAMNAGAR(W) ALAMNAGAR, MADHEPURA",,,1158,43
43302,"UTKRAMIT M S LAOAA LAGAN CHAUSA, MADHEPURA",,,1158,43
43303,"UTKRAMIT M S BARATAINI LASKARI UDAKISHANGANJ, MADHEPURA",,,1158,43
43304,UTKRAMIT M S BHARAHI BAZAR MADANPUR MADHEPURA,,,1158,43
43305,"UTKRAMIT M S PARWA NAWTOL MURALIGANJ, MADHEPURA",,,1158,43
43306,"UTKRAMIT M S KARUVAILI BAISADH KUMARKHAND, MADHEPURA",,,1158,43
43307,"U M S SINGYON DOLAR PIPARAHI SINGHESWAR, MADHEPURA",,,1158,43
43308,"UTKRAMIT M S BARHARI BARHARI SINGHESHWAR, MADHEPURA",,,1158,43
43309,"UTKRAMIT M S CHINKNOTWA SRINAGAR GHAILARH, MADHEPURA",,,1158,43
43310,"UTKRAMIT M S RAHTA KUMARKHAND, MADHEPURA",,,1158,43
43311,"UTKRAMIT UCHCHA MADHYAMIK SCHOOL, SONBARSHA, SHANKARPUR, MADHEPURA",,,1158,43
43312,"UTKRAMIT MADHYAMIK SCHOOL BHELVA,, MADHEPURA",,,1158,43
43313,"UTKRAMIT MADHYAMIK SCHOOL GADHIYA, BIHARIGANJ, MADHEPURA",,,1158,43
43314,"UTKRAMIT MADHYAMIK SCHOOL UDA, MURLIGANJ, MADHEPURA",,,1158,43
43315,"UTKRAMIT MADHYAMIK SCHOOL RAHI, MURLIGANJ, MADHEPURA",,,1158,43
43316,"UTKRAMIT M S BRINDAWAN, MURLIGANJ, MADHEPURA",,,1158,43
43317,"UTKRAMIT M S PARMANANDPUR, KUMARKHAND, MADHEPURA",,,1158,43
43318,"UTKRAMIT M S KATHAUTIA, BIHARIGANJ, MADHEPURA",,,1158,43
43319,"UTKRAMIT M S TINKONAMA, MURLIGANJ, MADHEPURA",,,1158,43
43320,"UTKRAMIT M S RAJANI MILLIK, MURLIGANJ, MADHEPURA",,,1158,43
43321,"UTKRAMIT MADHYAMIK SCH BELARI,KUMARKHAND, MADHEPURA",,,1158,43
43322,"UTKRAMIT M S RAGHUNIA, KUMARKHAND, MADHEPURA",,,1158,43
43323,"UTKRAMIT MADHYAMIK SCHOOL SHAHPUR,GWALPARA, MADHEPURA",,,1158,43
43324,"UTKRAMIT MADHYAMIK SCHOOL RITA, SINGESHWER, MADHEPURA",,,1158,43
43325,"UTKRAMIT M S RATANPATTI BHELAHI, MURLIGANJ, MADHEPURA",,,1158,43
43326,"UTKRAMIT MADHYAMIK SCH LAXMIPUR,BIHARIGANJ, MADHEPURA",,,1158,43
43327,"UTKRAMIT H S KHUTHA RAJAI,KUMARKHAND, MADHEPURA",,,1158,43
43328,"UTKRAMIT M S TARHA DANDARI, SINGHESHWAR, MADHEPURA",,,1158,43
43329,"UTKRAMIT MADHYAMIK SCHOOL SABAILA,SINGHESHWER, MADHEPURA",,,1158,43
43330,"UTKRAMIT M S JITAPUR,MURLIGANJ, MADHEPURA",,,1158,43
43331,"UTKRAMIT M S BISHPATTI, BIHARIGANJ, MADHEPURA",,,1158,43
43332,"UTKRAMIT MADHYAMIK SCHOOL MAANPUR, KUMARKHAND, MADHEPURA",,,1158,43
43333,"UTKRAMIT M S TEMABHELA, UDAKISHUNGANJ, MADHEPURA",,,1158,43
43334,"UTKRAMIT MADHYAMIK SCH PATORI,SINGHESHWAR, MADHEPURA",,,1158,43
43335,"KABIR GANGA U M S BIRIRANPAL,UDAKISHUNGANJ, MADHEPURA",,,1158,43
43336,"UTKRAMIT MADHYAMIK SCH RAMGANJ, BIHARIGANJ, MADHEPURA",,,1158,43
43337,"UTKRAMIT M S ISRAIEN GOATH,KUMARKHAND, MADHEPURA",,,1158,43
43338,"UTKRAMIT M S MAJAOURA, UDAKISHUNGANJ, MADHEPURA",,,1158,43
43339,"UTKRAMIT MADHYAMIK SCHOOL HARIHARPUR BAJRAHA, MADHEPURA",,,1158,43
43340,"UTKRAMIT M S KHOKHSI BARA RAMGANJ, MADHEPURA",,,1158,43
43341,"TANUKLAL YADAV NAV UTKRAMIT MADHYAMIK SCHOOL , KAPSIA, MADHEPURA",,,1158,43
43342,"UTKRAMIT MADHYAMIK SCHOOL DIGGHI, MADHEPURA",,,1158,43
43343,"UTKRAMIT MADHYAMIK SCHOOL SUNDERNAGAR (ST), MADHEPURA",,,1158,43
43344,"UTKRAMIT KAMESHWAR UCHH MADHYAMIK SCHOOL, PARMANANDPUR, GHAILADH, MADHEPURA",,,1158,43
43345,"UTKRAMIT UCHH MADHYAMIK SCHOOL, SHRINAGAR, GHAILADH, MADHEPURA",,,1158,43
43346,"UTKRAMIT UCHH MADHYAMIK SCHOOL, KARARIYA, PURAINI, KUMARKHAND, MADHEPURA",,,1158,43
43347,"UTKRAMIT UCHH MADHYAMIK SCHOOL, KEWATGAMA, KUMARKHAND, MADHEPURA",,,1158,43
43348,"UTKRAMIT UCHH MADHYAMIK SCHOOL, PARMANANDPUR, KUMARKHAND, MADHEPURA",,,1158,43
43349,"UTKRAMIT UCHH MADHYAMIK SCHOOL, MALIYA, MADHEPURA",,,1158,43
43350,"UTKRAMIT UCHH MADHYAMIK SCHOOL, BHADOL, MADHEPURA",,,1158,43
43351,"UTKRAMIT UCHH MADHYAMIK SCHOOL, SAHUGARH, MADHEPURA",,,1158,43
