School Code,School Name,Address,Pincode,Block Code,District Code
72125,"RAM LAL HIGH SCHOOL KHAPURA, NALANDA",,,1378,72
72126,"HIGH SCHOOL BALDHA, NALANDA",,,1378,72
72127,"HIGH SCHOOL SHAMPUR DAMODARPUR, NALANDA",,,1378,72
72128,"HIGH SCHOOL KACHAHARIA, NALANDA",,,1378,72
72129,"HIGH SCHOOL PAMARA TRIBHUWAN BIGHA, NALANDA",,,1378,72
72130,"HIGH SCHOOL ASTA, NALANDA",,,1378,72
72131,"C M H/S YASHWANTPUR, NALANDA",,,1378,72
72132,"BAPU HIGH SCHOOL CHANDI, NALANDA",,,1378,72
72133,"VIKAS HIGH SCHOOL BHOBHI, NALANDA",,,1378,72
72134,"H/S TULSIGARH, NALANDA",,,1378,72
72135,"PROJECT R K B GIRLS H/S CHANDI, NALANDA",,,1378,72
72136,"NEHRU HIGH SCHOOL PRASADIHA, NALANDA",,,1378,72
72137,"HIGH SCHOOL LODIPUR USMANPUR, NALANDA",,,1378,72
72138,"SARVODAY H/S BAURIDIH, NALANDA",,,1378,72
72139,"GOVT HIGH SECONDARY SCHOOL KALYAN BIGHA, NALANDA",,,1378,72
72140,"PROJ GIRLS H S ASTHAWAN, NALANDA",,,1378,72
72301,"U M S GOVERDHAN BIGAHA MARAVRITH KATARISARI, NALANDA",,,1378,72
72302,"UTKRAMIT M S SINTHU BIHARSHARIF, NALANDA",,,1378,72
72303,"UTKRAMIT M S SUMKA BHAGWANPUR CHANDI, NALANDA",,,1378,72
72304,"UTKRAMIT M S AKBARPUR HILSA, NALANDA",,,1378,72
72305,"UTKRAMIT M S MADHURGANJ KOCHRA ISLAMPUR, NALANDA",,,1378,72
72306,"UTKRAMIT M S KUNDI DARUARA NURSARAI, NALANDA",,,1378,72
72307,"UTKRAMIT M S ISUA PAYREPUR GIRIYAK, NALANDA",,,1378,72
72308,"UTKRAMIT M S LAHUAR NAIPOKHAR, NALANDA",,,1378,72
72309,"UTKRAMIT M S NARHAR BIGAHA MAHURI, NALANDA",,,1378,72
72310,"UTKRAMIT M S BHAGWANPUR KATRISARAI, NALANDA",,,1378,72
72311,"U M S MAHANANDPUR RANABIGHA BIHARSHARIF, NALANDA",,,1378,72
72312,"UTKRAMIT M S MAJIDPUR, SARWADHI, BIHARSARIF, NALANDA",,,1378,72
72313,"UTKRAMIT M S DARARIYA BIGHA BELCHHI CHANDI, NALANDA",,,1378,72
72314,"UTKRAMIT M S RAISA MAHKAR CHANDI, NALANDA",,,1378,72
72315,"UTKRAMIT M S BABURBANNA CHOUSANDA PARWALPUR, NALANDA",,,1378,72
72316,"UTKRAMIT M S RASAI BIGHA AKBARPUR HILSA, NALANDA",,,1378,72
72317,"UTKRAMIT M S BARGOUNW ATNA ISLAMPUR, NALANDA",,,1378,72
72318,"UTKRAMIT M S BANBAG MAHUMDA ISLAMPUR, NALANDA",,,1378,72
72319,"UTKRAMIT M S AKOUNA KARJARA BEN, NALANDA",,,1378,72
72320,"U M S MICHAIGANJ SAKROURA PAPARNAUSA NURSARAI, NALANDA",,,1378,72
72321,"UTKRAMIT M S SAKUCHI SARAI GAGIPUR GIRIYAK, NALANDA",,,1378,72
72322,"URDU UTKRAMIT M S BARAKAR BARAKAR SILAO, NALANDA",,,1378,72
72323,"UTKRAMIT M S SHINGHAUL SASHOUR SARMERA, NALANDA",,,1378,72
72324,"UTKRAMIT M S RAMGANJ NOHSA BEN, NALANDA",,,1378,72
72325,"UTKRAMIT M S VASUEN RAJGIR, NALANDA",,,1378,72
72326,"UTTKRAMIT MADHYAMIK SCHOOL, MALIQEPUR, NALANDA",,,1378,72
72327,"UTTKRAMIT M S MOHIUDDINPUR, NALANDA",,,1378,72
72328,"UTTKRAMIT M S JAGDISHPUR TIYARI, NALANDA",,,1378,72
72329,"UTTKRAMIT M S PURAINI, NALANDA",,,1378,72
72330,"UTTKRAMIT M S LODIPUR, NALANDA",,,1378,72
72331,"UTKRAMIT M S MAULANACHACK ISLAMAPUR SUDHI, NALANDA",,,1378,72
72333,"UTKRAMIT MADHYAMIK SCHOOL HAWELI, BIHAR, NALANDA",,,1378,72
72335,"UTKRAMIT M S MUMRADAWAD, NURSARAI, NALANDA",,,1378,72
72336,"URDUTKRAMIT MADHYAMIK SCHOOL SOBAIT, SILAV, NALANDA",,,1378,72
72337,"UTKRAMIT MADHYAMIK SCHOOL CHANDI MAOU, SILAV, NALANDA",,,1378,72
72340,"UTKRAMIT M S SARDAR BIGHA, NURSARAI, NALANDA",,,1378,72
72341,"UTKRAMIT MADHYAMIK SCHOOL KOBIL, ISLAMAPUR, NALANDA",,,1378,72
72342,"UTKRAMIT M S HARGAOAN, BIHAR SARIF, NALANDA",,,1378,72
72344,"UTKRAMIT MADHYAMIK SCHOOL KUL, SILAV, NALANDA",,,1378,72
72345,"B K SINHA NAV UTKRAMIT MADHYAMIK SCHOOL NEHUSA, HARNAUT, NALANDA",,,1378,72
72347,"UTKRAMIT MADHYAMIK SCHOOL PANKI, SILAV, NALANDA",,,1378,72
72348,"UTKRAMIT MADHYAMIK SCHOOL KAJICHACK, SARMERA, NALANDA",,,1378,72
72350,"UTKRAMIT M S JAYKISHUN BIGHA, SILAV, NALANDA",,,1378,72
72351,"UTKRAMIT MADHYAMIK SCHOOL KAPSIYAWAN, HILSA, NALANDA",,,1378,72
72352,"UTKRAMIT MADHYAMIK SCHOOL MALAWAN, SERMERA, NALANDA",,,1378,72
72353,"UTKRAMIT M S SAKRAOUL, BIHAR SARIF, NALANDA",,,1378,72
72355,"UTKRAMIT M S PAROHA, BIHAR SARIF, NALANDA",,,1378,72
72357,"UTKRAMIT MADHYAMIK SCHOOL CHOURMA, ISLAMAPUR, NALANDA",,,1378,72
72358,"UTKRAMIT MADHYAMIK SCHOOL CHOURSUA, GIRIYAK, NALANDA",,,1378,72
72359,"UTKRAMIT MADHYAMIK SCHOOL BARSIYAWAN DANIYAWAN, PENDAPUR EKANGARSARAI, NALANDA",,,1378,72
72360,"UTKRAMIT MADHYAMIK SCHOOL, GANGAPUR, PALATPUR, VELARI, KATRISARAI, NALANDA",,,1378,72
72361,"UTKRAMIT MADHYAMIK SCHOOL, NAHUB, RAJGIR, NALANDA",,,1378,72
72362,"UTKRAMIT MADHYAMIK SCHOOL, SHAYDAVRAHI, JAYDPUR,THARTHARI, NALANDA",,,1378,72
72363,"NAV UTKRAMIT VIDALAYA, SHADIKPUR, MUBARAKPUR, HARNOUT NALANDA",,,1378,72
72364,"UPGRADED H/S SARTHA, CHANDI, NALANDA",,,1378,72
72501,"NIRJA KANYA SCHOOL RAJGIR, NALANDA",,,1378,72
72502,"R.K. SHAH H.P. ARYA GIRL'S H.S. HILSA, NALANDA",,,1378,72
72503,"KISHAN H S SCHOOL BARAKAR, NALANDA",,,1378,72
72504,"SANJYA GANDHI H S SCHOOL BLAWAPAR, NALANDA",,,1378,72
72505,"PANO SAHDEO H S SCHOOL HILSA, NALANDA",,,1378,72
72506,"PARAGATISHIL GIRL'S H/S EKANGARSARAI, NALANDA",,,1378,72
72507,"S C P V A H/S JAYANTIGRAM GULNI HAIDERPUR, NALANDA",,,1378,72
72508,"RAM PARIKHA SINGH YADAV M.H.S. MUWARKPUR, NALANDA",,,1378,72
72509,"BALIKA HIGH SCHOOL YOGIPUR GOSAIPUR, NALANDA",,,1378,72
72510,"R S H S DHURGAON MADANPUR, NALANDA",,,1378,72
72511,"S D B B P GIRLS H S AUNGARI DHAM, NALANDA",,,1378,72
72512,"RAM RATI KAMLA KANYA H/S RACHI ROAD HARNAUT, NALANDA",,,1378,72
72513,"HIGH SCHOOL SAUNRAY BEN, NALANDA",,,1378,72
72514,"INDIRA GANDHI BALIKA HIGH SCHOOL TELHARA, NALANDA",,,1378,72
72515,"BAPU SMARAK HIGH SCHOOL,AJNAURA, NALANDA",,,1378,72
72516,"MEDINI UMA HIGH SCHOOL,TURI, NALANDA",,,1378,72
72517,"FAIZANUL O LOOM URDU GIRL'S H/S,BIHAR SHARIF, NALANDA",,,1378,72
72518,"ARYA KANYA HIGH SCHOOL TELHARA, NALANDA",,,1378,72
72519,"RAJO RAGHUNATH HIGH SCHOOL,ISUA SARMERA, NALANDA",,,1378,72
72520,"BALIKA UCHCH VIDYALAYA NAGARNAUSA, NALANDA",,,1378,72
72521,"GAUTAM BUDH HIGH SCHOOL TETRAWAN, NALANDA",,,1378,72
72522,"RAM NANDAN BABU HIGH SCHOOL,INDAUT NALANDA",,,1378,72
72523,"GRAMIN HIGH SCHOOL,BESHWAK,ISLAMPUR,NALANDA",,,1378,72
72524,"RAMSHARAN TUKESHWARI HIGH SCHOOL,CHERON, NALANDA",,,1378,72
72525,"HIGH SCHOOL JIYAR, NALANDA",,,1378,72
72526,"DR RAMRAJ KARU SINGH SMARAK HIGH SCHOOL RENRI, NALANDA",,,1378,72
72527,"S R D R H/S PHALHANWAN, NALANDA",,,1378,72
72528,"HARIJAN HIGH SCHOOL KUNDI NARSARAI, NALANDA",,,1378,72
72529,"DR RAM RAJ SINGH HIGH SCHOOL PANDEUCHAK, NALANDA",,,1378,72
72530,"R C S Y HIGH SCHOOL DAMODAR SARAI MANPUR, NALANDA",,,1378,72
72531,"HIGH SCHOOL MADHOPUR CHANDI, NALANDA",,,1378,72
72532,"M R S GIRLS H/S UTRA BHERIA, NALANDA",,,1378,72
72533,"SANGAT HIGH SCHOOL NOORSARAI, NALANDA",,,1378,72
72534,"ADARSH HIGH SCHOOL MUFTIGANJ SAIDPUR, NALANDA",,,1378,72
72535,"ANUGARAH NARAYAN SINGH H/S HAWANPURA, NALANDA",,,1378,72
72536,"SRI BHATU MAHETO HIGH SCHOOL CHANDOURA, NALANDA",,,1378,72
72537,"VIVEKANAND GIRL'S H/S GULABNAGAR ISLAMPUR, NALANDA",,,1378,72
72538,HIGH SCHOOL MAJIDPUR NALANDA,,,1378,72
72539,"SONA BALDEO HIGH SCHOOL CHERON SARMERA, NALANDA",,,1378,72
72541,"A R R D H/S RAJABIGHA,PO MAYER,NALANDA",,,1378,72
72543,"HIGH SCHOOL MALIKPUR,SILAO, NALANDA",,,1378,72
72544,"RAM CHANDRA CHOUHAN H/S MANIYARPUR,GONKURI, NALANDA",,,1378,72
73001,"ZILA SCHOOL ARRAH, BHOJPUR",,,1421,73
73002,H N K HIGH SCHOOL ARRAH BHOJPUR,,,1421,73
73003,TOWN HIGH SCHOOL ARRAH BHOJPUR,,,1421,73
73004,"H P D JAIN HIGH SCHOOL ARRAH, BHOJPUR",,,1421,73
73005,"SHRI JAIN KANYA PATHSHALA H/S ARRAH, BHOJPUR",,,1421,73
73006,"JAINBALA VISHRAM GIRLS H/S ARRAH, BHOJPUR",,,1421,73
73007,"DR N C S GIRLS HIGH SCHOOL ARRAH, BHOJPUR",,,1421,73
73008,"AMIRCHAND GIRLS HIGH SCHOOL ARRAH, BHOJPUR",,,1421,73
73009,GOVT GIRLS H/S ARRAH BHOJPUR,,,1421,73
73010,"GOVT SC RESIDENTIAL GIRLS H/S ARRAH, BHOJPUR",,,1421,73
73011,"GOVT SC RESIDENTIAL H/S MAULABAGH, BHOJPUR",,,1421,73
73012,R N PANDEY H/S ARRAH BHOJPUR,,,1421,73
73013,MODEL INSTITUTE ARRAH BHOJPUR,,,1421,73
73014,"CATHOLIC HIGH SCHOOL ARRAH, BHOJPUR",,,1421,73
73015,S B HIGH SCHOOL ARRAH BHOJPUR,,,1421,73
73016,"YADAV VIDYAPITH H/S MAULABAGH, BHOJPUR",,,1421,73
73017,"S N LAL HIGH SCHOOL AKHAGAON, BHOJPUR",,,1421,73
73018,M S H/S EKAWANA KUIYAN BHOJPUR,,,1421,73
73019,S R S R D GIRLS H/S ASANI BHOJPUR,,,1421,73
73020,S J S HIGH SCHOOL ASANI BHOJPUR,,,1421,73
73021,S S D & A S H/S BALUA BHOJPUR,,,1421,73
73022,"HIGH SCHOOL BAKHARIYAN, BHOJPUR",,,1421,73
73023,"R C S HIGH SCHOOL BIRAHIMPUR KARJA, BHOJPUR",,,1421,73
73024,R N HIGH SCHOOL BIRAMPUR BHOJPUR,,,1421,73
73025,"B R B H/S KRISHNABAG BABHANAULI, BHOJPUR",,,1421,73
73026,HIGH SCHOOL BABURA BHOJPUR,,,1421,73
73027,"S J C HIGH SCHOOL BELAUR, BHOJPUR",,,1421,73
73028,G R P V H/S BHATOULI BHOJPUR,,,1421,73
73029,"K V M HIGH SCHOOL CHHOTA SASARAM, BHOJPUR",,,1421,73
73030,HARBANSH H/S CHANDI BHOJPUR,,,1421,73
73031,B K HIGH SCHOOL DULARPUR BHOJPUR,,,1421,73
73032,HIGH SCHOOL DHANDIHA BHOJPUR,,,1421,73
73033,"T A J HIGH SCHOOL DHAMAR, BHOJPUR",,,1421,73
73034,GIRLS HIGH SCHOOL DHANDIHA BHOJPUR,,,1421,73
73035,R D M HIGH SCHOOL GADHANI BHOJPUR,,,1421,73
73036,HIGH SCHOOL GAZIAPUR BHOJPUR,,,1421,73
73037,HIGH SCHOOL JOGTA BHOJPUR,,,1421,73
73038,HIGH SCHOOL KARARI BHOJPUR,,,1421,73
73039,T M B S HIGH SCHOOL KOILWAR BHOJPUR,,,1421,73
73040,M B HIGH SCHOOL KULHARIYA BHOJPUR,,,1421,73
73041,HIGH SCHOOL KHAWASPUR BHOJPUR,,,1421,73
73042,D N K HIGH SCHOOL KUSARE BHOJPUR,,,1421,73
73043,S B S B HIGH SCHOOL KASAP BHOJPUR,,,1421,73
73044,"HIGH SCHOOL KALYANPUR, BHOJPUR",,,1421,73
73045,"T S HIGH SCHOOL MATUKPUR, BHOJPUR",,,1421,73
73046,HIGH SCHOOL MASARH BHOJPUR,,,1421,73
73047,R K S HIGH SCHOOL PAWNA BHOJPUR,,,1421,73
73048,SARVODAYA H/S PIRAUTA BHOJPUR,,,1421,73
73049,"M J HIGH SCHOOL RAJAPUR, BHOJPUR",,,1421,73
73050,PROJECT GIRLS H/S RAMSHAHAR BHOJPUR,,,1421,73
73051,S S S HIGH SCHOOL SARAIYA BHOJPUR,,,1421,73
73052,S S HIGH SCHOOL SANDESH BHOJPUR,,,1421,73
73053,HIGH SCHOOL SARATHUA BHOJPUR,,,1421,73
73054,R J H/S UDWANT NAGAR BHOJPUR,,,1421,73
73055,"KANYA H S KULHARIA, BHOJPUR",,,1421,73
73056,"SRI HARKHEN KUMAR JAIN GYAN STHALI ARA, BHOJPUR",,,1421,73
73057,"N S HIGH SCHOOL ARAILA, BHOJPUR",,,1421,73
73058,HIGH SCHOOL AYER BHOJPUR,,,1421,73
73059,HIGH SCHOOL BHARAULI BHOJPUR,,,1421,73
73060,M M D J HIGH SCHOOL BARNAON BHOJPUR,,,1421,73
73061,HIGH SCHOOL BEHEA BHOJPUR,,,1421,73
73062,"KASTURBA GIRLS HIGH SCHOOL BEHEA, BHOJPUR",,,1421,73
73063,R N HIGH SCHOOL BILAUTI BHOJPUR,,,1421,73
73064,JANTA HIGH SCHOOL BALIGAON BHOJPUR,,,1421,73
73065,HIGH SCHOOL BARISWAN BHOJPUR,,,1421,73
73066,M HIGH SCHOOL BARA BHOJPUR,,,1421,73
73067,H D R H/S BIHIYAN CHAURASTA BHOJPUR,,,1421,73
73068,V HIGH SCHOOL DALIPPUR BHOJPUR,,,1421,73
73069,HIGH SCHOOL HARADIA BHOJPUR,,,1421,73
73070,"S S GIRLS HIGH SCHOOL JAGDISHPUR, BHOJPUR",,,1421,73
73071,S S HIGH SCHOOL JAGDISHPUR BHOJPUR,,,1421,73
73072,"HIGH SCHOOL JADOPUR, BHOJPUR",,,1421,73
73073,HIGH SCHOOL JHAWAN BENWALIA BHOJPUR,,,1421,73
73074,"D N HIGH SCHOOL KAHATHU MASURHI, BHOJPUR",,,1421,73
73075,D HIGH SCHOOL KARNAMEPUR BHOJPUR,,,1421,73
73076,HIGH SCHOOL KAURA BHOJPUR,,,1421,73
73077,HIGH SCHOOL PAHARPUR BHOJPUR,,,1421,73
73078,HIGH SCHOOL SAHJAULI BHOJPUR,,,1421,73
73079,S G VIDYALAYA SONBARSA BHOJPUR,,,1421,73
73080,H N H/S SHAHPURPATTI BHOJPUR,,,1421,73
73081,"S G S PROJECT GIRLS H/S SHAHPUR PATTI, BHOJPUR",,,1421,73
73083,HIGH SCHOOL AGIAON BAZAR BHOJPUR,,,1421,73
73084,"SARVODAY HIGH SCHOOL AGIAON, BHOJPUR",,,1421,73
73085,SAMTA HIGH SCHOOL AMORJA BHOJPUR,,,1421,73
73086,HIGH SCHOOL EKWARI BHOJPUR,,,1421,73
73087,HIGH SCHOOL BARKAGAON BHOJPUR,,,1421,73
73088,HIGH SCHOOL BAGHI BHOJPUR,,,1421,73
73089,S B K HIGH SCHOOL BARGAON BHOJPUR,,,1421,73
73090,HIGH SCHOOL BIHTA BHOJPUR,,,1421,73
73091,LAKHA HIGH SCHOOL BARNI BHOJPUR,,,1421,73
73092,"HIGH SCHOOL CHANDI, BHOJPUR",,,1421,73
73093,L M GIRLS H/S CHHAWARAHI BHOJPUR,,,1421,73
73094,HIGH SCHOOL CHAURI BHOJPUR,,,1421,73
73095,S G HIGH SCHOOL CHILHAR BHOJPUR,,,1421,73
73096,"PROJECT GIRLS HIGH SCHOOL CHARPOKHARI, BHOJPUR",,,1421,73
73097,HIGH SCHOOL DHRUBDIHAN BHOJPUR,,,1421,73
73098,"HIGH SCHOL DHANCHHUHAN, BHOJPUR",,,1421,73
73099,"D N HIGH SCHOOL GORPA, BHOJPUR",,,1421,73
73100,S S N HIGH SCHOOL HANSWADIH BHOJPUR,,,1421,73
73101,HIGH SCHOOL ITIMHA BHOJPUR,,,1421,73
73102,HIGH SCHOOL JAMUAON BHOJPUR,,,1421,73
73103,R D Y HIGH SCHOOL JITAURA BHOJPUR,,,1421,73
73104,"K K HIGH SCHOOL JAMORHI, BHOJPUR",,,1421,73
73105,"R B S HIGH SCHOL KHANANIKALAN, BHOJPUR",,,1421,73
73106,HIGH SCHOOL KATAR BHOJPUR,,,1421,73
73107,S R C U V MANDIR LAHTHAN BHOJPUR,,,1421,73
73108,"R P R HIGH SCHOOL MAJHIAON, BHOJPUR",,,1421,73
73109,HIGH SCHOOL MALAUR BHOJPUR,,,1421,73
73110,"HIGH SCHOOL PIRO, BHOJPUR",,,1421,73
73111,"TULSI HIGH SCHOOL PANWARI, BHOJPUR",,,1421,73
73112,"SMT TETARA H/S RANNI DUMARIYAN, BHOJPUR",,,1421,73
73113,SARYU VIDYAMANDIR SEMRAON BHOJPUR,,,1421,73
73114,N P HIGH SCHOOL SIKRAUL BHOJPUR,,,1421,73
73115,HIGH SCHOOL SAHAR BHOJPUR,,,1421,73
73116,"R P M HIGH SCHOOL SIKARAHATA, BHOJPUR",,,1421,73
73117,"HIGH SCHOOL SEDAHAN, BHOJPUR",,,1421,73
73118,"PROJECT GIRLS HIGH SCHOOL SAHAR, BHOJPUR",,,1421,73
73119,"PUSHPA H S PIRO, BHOJPUR",,,1421,73
73120,"PROJECT INDIRA GANDHI (+2) GIRLS H/S PHULARI, BHOJPUR",,,1421,73
73121,"SIR SHIVSAGAR RAM GULAM GOVT H/S HARIGAON, BHOJPUR",,,1421,73
73122,"PROJECT GIRLS HIGH SCHOOL JITAURA, BHOJPUR",,,1421,73
73123,"SMT.S.S.DUBEY +2 PR.GIRLS H/S MAHUON, BHOJPUR",,,1421,73
73301,"UTKRAMIT M S GUNDI EAST BARHARA, BHOJPUR",,,1421,73
73302,"UTKRAMIT M S JANGALDANA CHKAMA JAGDISHPUR, BHOJPUR",,,1421,73
73303,"UTKRAMIT M S NARAYANPUR AGIAW, BHOJPUR",,,1421,73
73304,"UTKRAMIT M S TAAR PIRO, BHOJPUR",,,1421,73
73305,"UTKRAMIT M S DEVCHANDA TILATH PIRO, BHOJPUR",,,1421,73
73306,"UTKRAMIT M S RUDRANAGAR BIHIYA, BHOJPUR",,,1421,73
73307,"UTKRAMIT M S LALOO DERA SHAHPUR, BHOJPUR",,,1421,73
73308,"UTKRAMIT M S VISHUNPURA, BHOJPUR",,,1421,73
73309,"UTKRAMIT M S KESHOPUR BAKARI, BHOJPUR",,,1421,73
73310,"UTKRAMIT M S KHUTHAWA MAPKALA TARARI, BHOJPUR",,,1421,73
73311,"UTKRAMIT M S BERATH RATNARH, BHOJPUR",,,1421,73
73312,"UTKRAMIT M S MUKUNDPUR, BHOJPUR",,,1421,73
73313,"UTKRAMIT M S KUMHAILA, BHOJPUR",,,1421,73
73314,"UTKRAMIT M S SONBARSA, BHOJPUR",,,1421,73
73315,"UTKRAMIT M S LASARHI, BHOJPUR",,,1421,73
73316,"UTKRAMIT M S ASLAN, BHOJPUR",,,1421,73
73317,"UTKRAMIT M S KAUP GARHANI, BHOJPUR",,,1421,73
73318,"HARIVANSH BEDAMO UMS SHALIGRAM SINGH TOLA,BARHARA, BHOJPUR",,,1421,73
73319,"UTKRAMIT M S PAKRI BARHARA, BHOJPUR",,,1421,73
73320,"UPGRAEDED M S DHANGAI, BASOUNI, JAGDISHPUR, BHOJPUR",,,1421,73
73321,"UTKRAMIT M S KAKILA, BHOJPUR",,,1421,73
73322,"UPGRAEDED M S ISARHI BIMBA, BHOJPUR",,,1421,73
73323,"UTKRAMIT M S RANISAGAR, BHOJPUR",,,1421,73
73324,"UTKRAMIT M S SIKARIYA TIYAR, BHOJPUR",,,1421,73
73325,"UTKRAMIT M S KOURIYA, BHOJPUR",,,1421,73
73327,"UTKRAMIT M S KHANGAONW, BHOJPUR",,,1421,73
73328,"UPGRAEDED M S NASRATPUR, BHOJPUR",,,1421,73
73329,"UTKRAMIT M S KARISATH, BHOJPUR",,,1421,73
73330,"UTKRAMIT M S NAWADA BEN, BHOJPUR",,,1421,73
73331,"UPGRAEDED M S CHOURAI, BHOJPUR",,,1421,73
73332,"UTKRAMIT M S JAWAINIYA, BHOJPUR",,,1421,73
73333,"UTKRAMIT M S SUHIYA SHAHPUR, BHOJPUR",,,1421,73
73334,"UTKRAMIT M S JETHWAR TARARI, BHOJPUR",,,1421,73
73335,"UTKRAMIT M S GAHRUAN, BHOJPUR",,,1421,73
73336,"UTKRAMIT M S KURMURI TARARI, BHOJPUR",,,1421,73
73337,"UTKRAMIT M S BARUHI SAHAR, BHOJPUR",,,1421,73
73338,"UTKRAMIT M S TARARI (HEAD, BHOJPUR",,,1421,73
73339,"UTKRAMIT M S KARTHA TARARI, BHOJPUR",,,1421,73
73340,"UTKRAMIT M S BAGAR TARARI, BHOJPUR",,,1421,73
73342,"UTKRAMIT M S CHAKIYA TARARI, BHOJPUR",,,1421,73
73343,"UPGRAEDED M S HETAMPUR, BHOJPUR",,,1421,73
73344,"UTKRAMIT M S BASANTPUR ARA, BHOJPUR",,,1421,73
73345,"UTKRAMIT M S NAWADA BARUHI, BHOJPUR",,,1421,73
73346,"NAV UTTKRAMIT M S KUDARIYA, BHOJPUR",,,1421,73
73347,"NAV UTTKRAMIT M S PAIGA, BHOJPUR",,,1421,73
73348,"NAV UTTKRAMIT M S SARA, BHOJPUR",,,1421,73
73349,"NAV U M S BHAKURA,TARARI BHOJPUR,S.DIV.PIRO, BHOJPUR",,,1421,73
73350,"NAV UTTKRAMIT M S NONUAR, BHOJPUR",,,1421,73
73351,"NAV UTTKRAMIT MADHYAMIK SCHOOL, BARKA DUMRA, BHOJPUR",,,1421,73
73352,"NAV UTTKRAMIT M S BARAULI, BHOJPUR",,,1421,73
73353,"NAV UTTKRAMIT M S DHANPURA, BHOJPUR",,,1421,73
73354,"NAV UTTKRAMIT M S PERHAP, BHOJPUR",,,1421,73
73355,"NAV UTTKRAMIT M S PURHARA, BHOJPUR",,,1421,73
73356,"NAV UTTKRAMIT M S HADIYABAD, BHOJPUR",,,1421,73
73358,"UTTKRAMIT MADHYAMIK SCHOOL,BIRPUR, BIHIYA, BHOJPUR",,,1421,73
73359,"PRAYOGIK UTTKRAMIT MADHYAMIK SCHOOL, BIHIYA, BHOJPUR",,,1421,73
73360,"UTTKRAMIT M S LAHANG, DUMARIA, SAHPUR, BHOJPUR",,,1421,73
73361,"UTTKRAMIT MADHYAMIK SCHOOL, AYAR, PIRO, BHOJPUR",,,1421,73
73363,"UTTKRAMIT MADHYAMIK SCHOOL,BAMPALI, UDWANT NAGAR,BHOJPUR",,,1421,73
73364,"UTTKRAMIT MADHYAMIK SCHOOL, LAHARABAD, PIRO, BHOJPUR",,,1421,73
73365,"UTTKRAMIT MADHYAMIK SCHOOL, KHAJURIA, ARA, BHOJPUR",,,1421,73
73366,"UTTKRAMIT MADHYAMIK SCHOOL, CHANDA, TARARI, BHOJPUR",,,1421,73
73367,"UTTKRAMIT MADHYAMIK SCHOOL, DAWA, JAGDISHPUR, BHOJPUR",,,1421,73
73368,"UTTKRAMIT MADHYAMIK SCHOOL LAKSHANPUR ARA, BHOJPUR",,,1421,73
73369,"UTTKRAMIT MADHYAMIK SCHOOL, CHACHAR,, BHOJPUR",,,1421,73
73370,"UTTKRAMIT M S BIRAMPUR, UDWANTNAGAR, BHOJPUR",,,1421,73
73371,"UTTKRAMIT M S BAIRAHI, JAGDISHPUR, BHOJPUR",,,1421,73
73372,"UTTKRAMIT M S NATHMALPUR, HARHARA, BHOJPUR",,,1421,73
73373,"UTTKRAMIT MADHYAMIK SCHOOL, BERAI (BHOJPUR), BHOJPUR",,,1421,73
73374,"UTKRAMIT MADHYAMIK SCHOOL, DEHRI, JAGDISHPUR, BHOJPUR",,,1421,73
73375,"UTKRAMIT MADHYAMIK SCHOOL, KARWASIN, AGAON, BHOJPUR",,,1421,73
73378,UPGRADE HIGH SCHOOL SHIVPUR BIHIYA BHOJPUR ,,,1421,73
73501,"RAJESHWARI ASHA GIRL'S H/S KARJA, BHOJPUR",,,1421,73
73502,"BAURAHAWA BABA H/S SOBHA TOLA DAWAN, BHOJPUR",,,1421,73
73503,"GAYA KESHAW ASHRAFI DEVI GIRL'S H/S NAWADABEN, BHOJPUR",,,1421,73
73504,"PARVATI KANYA HIGH SCHOOL AKHGAON, BHOJPUR",,,1421,73
73505,"TRIGUNA SINGH GIRL'S H/S MATUKPUR, BHOJPUR",,,1421,73
73507,"CHANDRIKA BADREE CHAUDHARY GIRLS H/S PARASIYA, BHOJPUR",,,1421,73
73508,"AMBIKA SHARAN SINGH H/S JAMALPUR, BHOJPUR",,,1421,73
73509,"KISHAN HIGH SCHOOL CHHAPRAPUR, BHOJPUR",,,1421,73
73510,"HIGH SCHOOL KHANDOL PHULARI, BHOJPUR",,,1421,73
73511,"KISAN BALIKA H/S PIRO, BHOJPUR",,,1421,73
73512,"SARSWATI KANYA H/S NARAYANPUR HASANBAZAR, BHOJPUR",,,1421,73
73513,"SHAKTI PRASAD SINGH GIRLS H/S DALIPPUR, BHOJPUR",,,1421,73
73514,HIGH SCHOOL NARAYANPUR BHOJPUR,,,1421,73
73515,"S.S.M. GIRL'S H/S DIGHA,MITHUTOLA, BHOJPUR",,,1421,73
73516,"RAJIV GANDHI GIRLS H/S MAHATMA GANDHI NAGAR, BHOJPUR",,,1421,73
73517,SAWTELLE MEMORIAL GIRLS H/S ARRA BHOJPUR,,,1421,73
73518,"ARSAD MEM.URDU G H S MILKI MUH-ARRAH,BHOJPUR",,,1421,73
73519,"RAMADHAR HARIBANSH SINGH GIRLS H/S BABURA, BHOJPUR",,,1421,73
73520,"NIRMALA SHIKSHA BHAWAN H/S SHAHPUR PATI, BHOJPUR",,,1421,73
73521,"M J KAPIL DEO HIGH SCHOOL RATNARH, BHOJPUR",,,1421,73
73701,"GYANODAYA +2 HIGH SCHOOL, BABHNAULI BHOJPUR",,,1421,73
73702,UNIVERSAL 10 + 2 PUBLIC SCHOOL BIHIYA BHOJPUR,,,1421,73
74001,"SHER-SHAH SURI U M V SASARAM, ROHTAS",,,1457,74
74002,S S +2 SCHOOL TAKIYA SASARAM ROHTAS,,,1457,74
74003,G P HIGH SCHOOL JAIPUR ROHTAS,,,1457,74
74004,H/S RAMESHWAR GANJ SASARAM ROHTAS,,,1457,74
74005,H/S CHAUKHANDA CHITAULI ROHTAS,,,1457,74
74006,"SANT SHIVANAND ACADEMY SASARAM, ROHTAS",,,1457,74
74007,RAJ KESHWAR HIGH SCHOOL KHURHNU ROHTAS,,,1457,74
74008,"H/S CHAUKHANDI PATH SASARAM, ROHTAS",,,1457,74
74009,RAMA JAIN GIRLS H/S SASARAM ROHTAS,,,1457,74
74010,S D HIGH SCHOOL SHIVSAGAR ROHTAS,,,1457,74
74011,HIGH SCHOOL RAIPURCHORE ROHTAS,,,1457,74
74012,"NEHRU SEVA SADAN H/S TORNI, ROHTAS",,,1457,74
74013,"SMT N K HIGH SCHOOL MOHANIAN, ROHTAS",,,1457,74
74014,"N S S H/S NISHAN NAGAR BADDI, ROHTAS",,,1457,74
74015,"R D G HIGH SCHOOL CHENARI, ROHTAS",,,1457,74
74016,ADARSH HIGH SCHOOL RERIYA ROHTAS,,,1457,74
74017,SARVODAYA HIGH SCHOOL SARAIYA ROHTAS,,,1457,74
74018,HIGH SCHOOL SADOKHAR ROHTAS,,,1457,74
74019,HIGH SCHOOL KARGAHAR ROHTAS,,,1457,74
74020,"ADARSH HIGH SCHOOL SAMAHUTA, ROHTAS",,,1457,74
74021,"K B HIGH SCHOOL KAPASIAN, ROHTAS",,,1457,74
74022,HIGH SCHOOL KOCHAS ROHTAS,,,1457,74
74023,S R N C HIGH SCHOOL DIBHIYAN ROHTAS,,,1457,74
74024,HIGH SCHOOL BILARI ROHTAS,,,1457,74
74025,K N H/S BARAHUTI KALAN ROHTAS,,,1457,74
74026,"HIGH SCHOOL KHARARI, ROHTAS",,,1457,74
74027,"HIGH SCHOOL BISODIHARI, ROHTAS",,,1457,74
74028,HIGH SCHOOL MAHULI ROHTAS,,,1457,74
74029,"HIGH SCHOOL AKHTIARPUR, ROHTAS",,,1457,74
74030,"S G N M HIGH SCHOOL PARSATHUA, ROHTAS",,,1457,74
74031,S A V HIGH SCHOOL RERIA ROHTAS,,,1457,74
74032,HIGH SCHOOL BABHANI ROHTAS,,,1457,74
74033,"S G P HARIJAN HIGH SCHOOL KOCHAS, ROHTAS",,,1457,74
74034,HIGH SCHOOL GARH NOKHA ROHTAS,,,1457,74
74035,SRI B C S HIGH SCHOOL NOKHA ROHTAS,,,1457,74
74036,SARVODAYA HIGH SCHOOL NOKHA ROHTAS,,,1457,74
74037,HIGH SCHOOL BARAON ROHTAS,,,1457,74
74038,RAM LAKHAN H/S BISIKALAN ROHTAS,,,1457,74
74039,"G S HIGH SCHOOL PACHPOKHRI, ROHTAS",,,1457,74
74040,"SHRI SHARDA H/S PARAWA PARASIAN, ROHTAS",,,1457,74
74041,SRI A N H/S SRINAGAR SISRIT ROHTAS,,,1457,74
74042,"S H U HIGH SCHOOL MEARI BAZAR, ROHTAS",,,1457,74
74043,PROJECT GIRLS H/S NOKHA ROHTAS,,,1457,74
74044,"A S T HIGH SCHOOL BARKI ANKORHI, ROHTAS",,,1457,74
74045,"GANGOTRI PROJECT GIRLS H/S CHENARI, ROHTAS",,,1457,74
74046,"GOVT SC RESI HIGH SCHOOL SASARAM, ROHTAS",,,1457,74
74047,"GOVT SC RESI GIRLS H/S SASARAM, ROHTAS",,,1457,74
74048,"PROJECT GIRLS HIGH SCHOOL KARGAHAR, ROHTAS",,,1457,74
74049,"S S ANUSUCHIT JATI H/S BISENI KHURD, ROHTAS",,,1457,74
74050,"COMPANY HIGH SCHOOL BANJARI, ROHTAS",,,1457,74
74051,"H S KATHARAIN, ROHTAS",,,1457,74
74052,"SANT ANNE'S H S BURHAN ROAD SASARAM, ROHTAS",,,1457,74
74053,S S SCHOOL BIKRAMGANJ ROHTAS,,,1457,74
74054,"K K HIGH SCHOOL SANJHAULI, ROHTAS",,,1457,74
74055,G S HIGH SCHOOL SANJHAULI ROHTAS,,,1457,74
74056,HIGH SCHOOL KUSUMHARA ROHTAS,,,1457,74
74057,SDRA HIGH SCHOOL KASTAR ROHTAS,,,1457,74
74058,R R HIGH SCHOOL GOTPA ROHTAS,,,1457,74
74059,HIGH SCHOOL SHEOPUR ROHTAS,,,1457,74
74060,S M K G H/S GANGAJAL MATH ROHTAS,,,1457,74
74061,HIGH SCHOOL TENDUNI ROHTAS,,,1457,74
74062,"Y H/S PRASHURAM NAGAR CHHULKAR, ROHTAS",,,1457,74
74063,R D S HIGH SCHOOL DHANGAIN ROHTAS,,,1457,74
74064,HIGH SCHOOL NASRIGANJ ROHTAS,,,1457,74
74065,SHAUNDIK HIGH SCHOOL RAJPUR ROHTAS,,,1457,74
74066,"R K HIGH SCHOOL MANGRAON, ROHTAS",,,1457,74
74067,"S N HIGH SCHOOL PARASIA THAKURAI, ROHTAS",,,1457,74
74068,BASANT H/S ITIMAHA KARMA ROHTAS,,,1457,74
74069,"JAI MANGAL HIGH SCHOOL PIPARDIH, ROHTAS",,,1457,74
74070,S N HIGH SCHOOL SUKAHARA ROHTAS,,,1457,74
74071,HIGH SCHOOL BURHWAL ROHTAS,,,1457,74
74072,S N HIGH SCHOOL OSAON ROHTAS,,,1457,74
74073,"BALDEO HIGH SCHOOL KAUPA, ROHTAS",,,1457,74
74074,R R HIGH SCHOOL GORARI ROHTAS,,,1457,74
74075,S S D HIGH SCHOOL AMAUNA ROHTAS,,,1457,74
74076,"H N HIGH SCHOOL AWADHESH NAGAR, ROHTAS",,,1457,74
74077,HIGH SCHOOL KURUR ROHTAS,,,1457,74
74078,R R HIGH SCHOOL SURAJPURA ROHTAS,,,1457,74
74079,J N HIGH SCHOOL KOATH ROHTAS,,,1457,74
74080,J D S HIGH SCHOOL DERHGAON ROHTAS,,,1457,74
74081,B R B HIGH SCHOOL GOSHALDIH ROHTAS,,,1457,74
74082,BALDEO HIGH SCHOOL DINARA ROHTAS,,,1457,74
74083,B S N HIGH SCHOOL SAISAR ROHTAS,,,1457,74
74084,"JANTA HIGH SCHOOL TENUAJ, ROHTAS",,,1457,74
74085,S H/S MAHABIR STHAN PITHANI ROHTAS,,,1457,74
74086,"SARVODAY HIGH SCHOOL GANJ BHARASARA, ROHTAS",,,1457,74
74087,"S Y HIGH SCHOOL BHALUNI DHAM, ROHTAS",,,1457,74
74088,"MOTI HIGH SCHOOL S S BASDIHAN, ROHTAS",,,1457,74
74089,S B HIGH SCHOOL ARTHU ROHTAS,,,1457,74
74090,"ADARSH HIGH SCHOOL SEMRA, ROHTAS",,,1457,74
74091,"SONAMATI MANGRU HIGH SCHOOL CHITAON, ROHTAS",,,1457,74
74092,SWAMI SHIVANAND H/S KARHANSI ROHTAS,,,1457,74
74093,"S S P S H/S NARWAR BHAGIRTHA, ROHTAS",,,1457,74
74094,"BALIKA UCH VIDAYALAY GANJ BHARASARA, ROHTAS",,,1457,74
74095,"PROJECT GIRLS H/S NASRIGANJ, ROHTAS",,,1457,74
74096,PROJECT GIRLS H/S DAWATH ROHTAS,,,1457,74
74097,"PROJECT GIRLS H/S SANJHAULI, ROHTAS",,,1457,74
74098,"R P S H/S BARKAGAON RAKASIYA, ROHTAS",,,1457,74
74099,PROJECT GIRLS H/S KARAKAT ROHTAS,,,1457,74
74100,S S HIGH SCHOOL KAITHI ROHTAS,,,1457,74
74101,"R P S HIGH SCHOOL KAWAI, ROHTAS",,,1457,74
74102,"V K Y H S MEDANIPUR, ROHTAS",,,1457,74
74103,"MATIRANI BALIKA H S KUSHI, ROHTAS",,,1457,74
74104,HIGH SCHOOL TILOUTHU ROHTAS,,,1457,74
74105,S B P HIGH SCHOOL INDRAPURI ROHTAS,,,1457,74
74106,HIGH SCHOOL DALMIA NAGAR ROHTAS,,,1457,74
74107,"BALIKA UCH VIDYALAYA DALMIA NAGAR, ROHTAS",,,1457,74
74108,"HIGH SCHOOL DEHRI ON SONE ROHTS, ROHTAS",,,1457,74
74109,HIGH SCHOOL PREM NAGAR ROHTAS,,,1457,74
74110,"A S J HIGH SCHOOL JAGODIH, ROHTAS",,,1457,74
74111,HIGH SCHOOL ROHTAS,,,1457,74
74112,J C R GIRLS H/S MADHURAM PUR ROHTAS,,,1457,74
74113,P P C M VIDYALAYA AMJHORE ROHTAS,,,1457,74
74114,C J HIGH SCHOOL BHIMKARUP ROHTAS,,,1457,74
74115,BAULIA HIGH SCHOOL BAULIA ROHTAS,,,1457,74
74116,HIGH SCHOOL NAUHATTA ROHTAS,,,1457,74
74117,"PROJECT GIRLS HIGH SCHOOL NAUHATTA, ROHTAS",,,1457,74
74118,"A K JAIN HIGH SCHOOL DARIHAT, ROHTAS",,,1457,74
74119,"SRI SITARAM H/S BARAONKALA, ROHTAS",,,1457,74
74120,HIGH SCHOOL JAMUHAR ROHTAS,,,1457,74
74121,"S J R HIGH SCHOOL VISHUNPUR, ROHTAS",,,1457,74
74122,"ADARSH HIGH SCHOOL RAMDIHRA, ROHTAS",,,1457,74
74123,"HIGH SCHOOL CHANP, ROHTAS",,,1457,74
74124,"RASTRIYA HIGH SCHOOL DILIAN, ROHTAS",,,1457,74
74125,SUDAMA HIGH SCHOOL SIDHAULI ROHTAS,,,1457,74
74126,"SHRAMIK HIGH SCHOOL PIPRADIH, ROHTAS",,,1457,74
74127,HIGH SCHOOL BHERIA SUARA ROHTAS,,,1457,74
74128,PROJECT GIRLS HIGH SCHOOL ROHTAS,,,1457,74
74129,"R R JAIN GIRLS H/S DEHRIONSONE, ROHTAS",,,1457,74
74130,"R P GIRLS HIGH SCHOOL DARIHAT, ROHTAS",,,1457,74
74131,H S HIGH SCHOOL HURKA ROHTAS,,,1457,74
74132,GOVT ST RES HIGH SCHOOL SOLI ROHTAS,,,1457,74
74133,"MAHADEOPURI HIGH SCHOOL BHADARA, ROHTAS",,,1457,74
74134,"B V B H S CHANDANPURA, ROHTAS",,,1457,74
74135,"H S RASOOLPUR, ROHTAS",,,1457,74
74136,"GOVT O B C GIRL'S RES +2 SCHOOL MOKAR SASARAM, ROHTAS",,,1457,74
74301,"UTKRAMIT M S GANGAULI DEHARI, ROHTAS",,,1457,74
74302,"UTKRAMIT M S SARANA KARANJ DHINARA, ROHTAS",,,1457,74
74303,"UTKRAMIT M S TORANI RIWA KARGAHAR, ROHTAS",,,1457,74
74304,"UTKRAMIT M S MAHUARI KAPASIYA KOCHAS, ROHTAS",,,1457,74
74305,"UTKRAMIT M V GADURA, SHIVSAGAR, ROHTAS",,,1457,74
